Case Number,Date,Year,Type,Country,Area,Location,Activity,Sex,Age,Injury,Fatal,Time,Investigator or Source
1985.01.04,04-Jan-1985,1985,Unprovoked,SOUTH AFRICA,Western Cape Province,"Buffels Bay, False Bay",Spearfishing,M,34,Minor injury to torso,N,morning,"D. James, M. Levine, GSAF; G. Cliff, NSB"
1985.01.00.b,Jan-1985,1985,Unprovoked,NEW CALEDONIA,South Province,Amedee Island,Spearfishing,,,Legs bitten ,N,,"W. Leander; Les Nouvelles Caledoniennes, 3/17/2000"
1985.01.00.a,Jan-1985,1985,Provoked,SOUTH AFRICA,KwaZulu-Natal,Salt Rock,Spearfishing,M,20,Upper right arm bitten after he shot the shark PROVOKED INCIDENT,N,morning,"B. Coppin, M. Levine, GSAF"
1985.00.00.a,1985,1985,Unprovoked,IRAN,,"Ramin, near Ahvaz",Fishing,M,,FATAL,Y,,B. Coad & F. Papahn
1984.11.30,30-Nov-1984,1984,Unprovoked,AUSTRALIA,Queensland,1 km off Black's Beach,Sailing on catamaran & fell into the water,M,16,FATAL,Y,morning,"Courier-Mail, 12/1/1984, p.1; A. Sharpe, p.106"
1984.11.11,11-Nov-1984,1984,Unprovoked,USA,Florida,"Jupiter Island Beach, Martin County",Surfing,M,13,Left foot bitten,N,,"Miami Herald, 11/18/1984"
1984.11.04,04-Nov-1984,1984,Provoked,USA,Florida,"Fowey Rock, Key Biscayne",Spearfishing,M,29,"Speared shark bit diver's right knee, and lacerated right thigh & buttocks PROVOKED INCIDENT",N,,"Miami Herald, 11/5/1984"
1984.10.21.b,21-Oct-1984,1984,Invalid,USA,Florida,"Wabasso Beach, Indian River County",Swimming,M,22,"Disappeared, 1 mile from where Sandra Fletcher was bitten. Death was due to drowning",,afternoon,"Evening Independent, 10/24/1984, p.14;      E. Pace, FSAF"
1984.10.21,21-Oct-1984,1984,Unprovoked,USA,Florida,"3 miles south of Sebastian Inlet State Park, Indian River County",Surfing or body surfing,F,23,"9"" laceration to right forearm ",N,morning,"Miami Herald, 10/24/1984, p.17A"
1984.10.17,17-Oct-1984,1984,Invalid,USA,Florida,"Boynton Beach, Palm Beach County",Wading,F,77,"10"" laceration on leg",,morning,"Miami Herald, 10/18/1984, "
1984.10.14.a,14-Oct-1984,1984,Unprovoked,USA,Florida,"Bob Graham Beach, Martin County",Surfing,M,15,Left calf bitten,N,afternoon,"Miami Herald, 10/16/1984"
1984.09.30.b,30-Sep-1984,1984,Unprovoked,USA,Oregon,"""Turnaround"", Cape Kiwanda, Tillamook County",Surfing (sitting on his board),M,25,"Abrasion on right foot, board bitten",N,afternoon,"R. Collier, pp.94-95"
1984.09.30.a,30-Sep-1984,1984,Unprovoked,USA,California,"Tomales Point, Marin County","Free diving , but surfacing",M,,Legs & buttocks bitten,N,morning,"R. Collier, pp.93-94"
1984.09.23,23-Sep-1984,1984,Unprovoked,USA,Florida,Volusia County,Surfing,M,17,Right foot bitten,N,afternoon,"Miami Herald, 9/26/1984, p.2D"
1984.09.22.b,22-Sep-1984,1984,Unprovoked,USA,Florida,,Swimming,M,,Left foot lacerated,N,,"Miami Herald, 9/26/1984, p.2D"
1984.09.22.a,22-Sep-1984,1984,Unprovoked,USA,Florida,"Indiatlantic, Brevard County",Surfing,M,16,Foot bitten,N,morning,"Miami Herald, 9/26/1984, p.2D"
1984.09.17,17-Sep-1984,1984,Unprovoked,USA,California,"Mission Beach, San Diego County",Wading,M,,Arm bitten,N,afternoon,"R. Collier, p.93 "
1984.09.15,15-Sep-1984,1984,Unprovoked,USA,California,"Pigeon Point, San Mateo County",Skindiving,M,28,FATAL,Y,morning,"R. Collier, p. 72"
1984.09.11,11-Sep-1984,1984,Provoked,MEXICO,Baja California,Guadalupe Island,Spearfishing,M,,"No Injury, PROVOKED INCIDENT",N,afternoon,R. Collier
1984.08.24,24-Aug-1984,1984,Invalid,USA,Florida,"Off Crystal River, Citrus County",Boat capsized?,F,31,Death was due to drowning; body scavenged by a tiger shark,,,"St. Petersburg Times, 11/20/1984"
1984.07.24.b,24-Jul-1984,1984,Unprovoked,USA,Texas,South Padre Island,Swimming,F,13,Lacerations on right foot,N,afternoon,"A. MacCormick, pp.8-9"
1984.07.24.a,24-Jul-1984,1984,Unprovoked,USA,Texas,South Padre Island,Swimming,F,18,Legs severely lacerated,N,morning,"A. MacCormick, pp.8-9"
1984.07.22,22-Jul-1984,1984,Invalid,SOUTH AFRICA,Western Cape Province,Cape Point,Spearfishing,M,21,"FATAL, but shark involvement prior to death could not be determined",,morning,"P. Landsberg, M.D."
1984.07.01,01-Jul-1984,1984,Unprovoked,USA,Florida,,"During a shark fishing tournament, the 18' Boatem was capsized by waves, throwing 3 men into the water ",M,30,Leg abraded,N,afternoon,"New Orleans Times-Picayune, 3 July 1984; A. MacCormick, p.109-110"
1984.07.00.a,Jul-1984,1984,Unprovoked,SOUTH AFRICA,KwaZulu-Natal,Sodwana,Spearfishing,M,,"No injury, shark hit swim fin",N,,"R O'Connor, M. Levine, GSAF"
1984.06.15,15-Jun-1984,1984,Unprovoked,SOUTH AFRICA,Western Cape Province,"Muizenberg, False Bay",Surfing,M,27,"No injury, board bitten",N,afternoon,"The Argus, 6/16/1984"
1984.06.03.b,03-Jun-1984,1984,Unprovoked,USA,Hawaii,"Kane'ohe Bay, O'ahu",Towing her sister on plastic ski board,F,13,Foot bitten,N,afternoon,"J. Borg, p.76; L. Taylor (1993), pp.106-107"
1984.06.03,03-Jun-1984,1984,Unprovoked,VANUATU,Malampa Province,"Atchin Island, off Malakula",Swimming,M,20,FATAL,Y,,"Telegraph, 6/8/1984, p.12 "
1984.05.31,31-May-1984,1984,Unprovoked,SOUTH AFRICA,Western Cape Province,Arniston,Spearfishing,M,28,Swim fin bitten,N,morning,"A. Bosman, M. Levine, GSAF"
1984.03.14,14-Mar-1984,1984,Unprovoked,SOUTH AFRICA,KwaZulu-Natal,Amanzimtoti,Surfing,M,,"No injury, 8 pressure dings in surboard",N,afternoon,"G. Charter, NSB; M. Levine, GSAF"
1984.03.10,10-Mar-1984,1984,Boating,SOUTH AFRICA,Eastern Cape Province,Swartkops River mouth,Rowing,M,,"No injury to occupant, shark seized oar and disappeared with it.",N,,"M. Levine, GSAF"
1984.02.18,18-Feb-1984,1984,Provoked,SOUTH AFRICA,Eastern Cape Province,"Paradise Beach, Jeffreys Bay",Fishing,M,,Leg lacerated by hooked shark PROVOKED INCIDENT,N,night,"M. Levine, GSAF; Eastern Province Herald, 6/28/1986"
1984.02.17,17-Feb-1984,1984,Provoked,SOUTH AFRICA,KwaZulu-Natal,"Shark tank at Oceanographic Research Insitute, Durban",Scuba diving,M,33,Punctures in wetsuit & left arm bruised by captive shark PROVOKED INCIDENT,N,morning,"G. Buckland, M. Levine, GSAF"
1984.02.11,11-Feb-1984,1984,Unprovoked,AUSTRALIA,Queensland,Derwent Island,Spearfishing,M,27,Hand bitten,N,,"Courier-Mail, 2/14/1984, p.3"
1984.01.05,05-Jan-1984,1984,Unprovoked,SOUTH AFRICA,Eastern Cape Province,Port Alfred,Swimming,M,14,Foot bitten,N,morning,"R. Tennent, M. Levine, Dr. Dempers & K. Reynolds"
1984.01.04,04-Jan-1984,1984,Unprovoked,SOUTH AFRICA,KwaZulu-Natal,Umlaas Canal,,F,14,Remains recovered 1-4-1984 showed evidence of defense wounds,Y,,"G. Charter, B. Davis & G. Cliff, NSB"
1984.00.00.b,1984,1984,Provoked,USA,California,San Francisco,Steinhart Aquarium,M,,Head mouthed by captive shark PROVOKED INCIDENT,N,,D.C. Reed
1984.00.00.a,1984,1984,Unprovoked,USA,Florida,"Indiatlantic, Brevard County",Surfing,M,,Right foot bitten,N,,"M. Vosburgh, Orlando Sentinel, 5/28/1988 "
1983.12.30,30-Dec-1983,1983,Invalid,GREECE,Andikira Fokithes,,Spearfishing,M,36,"Coroner determined the man was killed by a boat propeller, not a tiger shark",,,"Miami Herald, 1/4/1984; M. Bardanis"
1983.12.25,25-Dec-1983,1983,Unprovoked,USA,Florida,"Riviera Beach, Palm Beach County",Surfing,M,17,Left foot & thigh bitten,N,afternoon,"Palm Beach Post, 12/26/1983   "
1983.12.24,24-Dec-1983,1983,Unprovoked,AUSTRALIA,South Australia,"Dangerous Reef, South Neptune Island",Scuba diving for abalone,M,48,Fingers bitten,N,,"T. Peake, GSAF"
1983.12.22,22-Dec-1983,1983,Unprovoked,SOUTH AFRICA,Eastern Cape Province,Great Fish River,Swimming,M,16,"Left calf, ankle & foot lacerated",N,morning,"C. Biggs, M. Levine, J. Mansfield, Dr. T. Counihan & Dr. Clement"
1983.12.21,21-Dec-1983,1983,Unprovoked,SOUTH AFRICA,Eastern Cape Province,Nahoon,Swimming,M,47,Shin lacerated,N,morning,"R. Horn, East London Aquarium;  J. Heydenrych, M.Levine, GSAF"
1983.11.21,21-Nov-1983,1983,Sea Disaster,PHILIPPINES,Central Philippines,,Ferry boat sank,M,,Left foot nipped,N,,"Montreal Gazette, 11/28/1983"
1983.11.10.R,Reported      10-Nov-1983,1983,Unprovoked,USA,Florida,"Melbourne Beach, Brevard County",Surfing,M,15,Laceration to left foot,N,,"St. Petersburg Times, 11/10/1983"
1983.11.10,10-Nov-1983,1983,Invalid,SOUTH AFRICA,KwaZulu-Natal,Tongaat,Swimming,F,,Probable drowning and scavenging,,,"R. Wilson, G. Cliff, Natal Sharks Board; GSAF"
1983.10.17.a,17-Oct-1983,1983,Unprovoked,USA,Florida,"Stuart Beach, Martin County",Surfing,M,16,Puncture marks in leg & surfboard dinged,N,,"Miami Herald, 10/21/1983, p.1C"
1983.10.13,13-Oct-1983,1983,Unprovoked,USA,Florida,"Daytona Beach, Volusia County",Wading,M,20,Lacerations to left ankle,N,,"Daytona Beach Morning Journal, 10/21/1983"
1983.09.04,04-Sep-1983,1983,Unprovoked,USA,Florida,"Off Lake Worth, Palm Beach County",Standing,M,15,Abrasions to leg,N,,"E. Pace, FSAF"
1983.08.20.b,20-Aug-1983,1983,Unprovoked,USA,Oregon,"Cape Kiwanda,Tillamook County",Surfing,M,,"No injury, board bitten",N,morning,"R.N. Lea & D. Miller; R. Collier, p.81"
1983.08.20.a,20-Aug-1983,1983,Unprovoked,SOUTH AFRICA,Western Cape Province,"Seal Island, False Bay",Spearfishing,M,29,Inner thighs lacerated,N,morning,"A. Louw, M. Levine,  GSAF; G. Cliff, NSB"
1983.08.15,15-Aug-1983,1983,Unprovoked,USA,Virginia,"Virginia Beach, Princess Anne County",Swimming,F,14,Foot bitten,N,morning,"Washington Post, 8/16/1983"
1983.08.13.b,13-Aug-1983,1983,Provoked,USA,Florida,"Riviera Beach, Palm Beach County",Skindiving,M,14,Hand abraded when he grabbed shark's tail PROVOKED INCIDENT,N,,M. Vorenburg. GSAF
1983.08.13.a,13-Aug-1983,1983,Unprovoked,USA,Florida,"6 miles south of Boca Chica Key, Monroe County ",Diving,F,22,Right leg severely bitten,N,morning,"Miami Herald, 8/14/1983, p.1D "
1983.07.26,26-Jul-1983,1983,Sea Disaster,AUSTRALIA,Queensland,"Off Lodestone Reef, Great Barrier Reef, north of Townsville",Swimming from the New Venture ,F,21,"FATAL, shark seized her by the chest and took her underwater ",Y,,"B. Myatt, GSAF"
1983.07.25.b,25-Jul-1983,1983,Sea Disaster,AUSTRALIA,Queensland,"Off Lodestone Reef, Great Barrier Reef, north of Townsville",Swimming from the New Venture ,M,24,"FATAL, shark bit leg, then dragged him underwater ",Y,night,"H. Edwards, pp. 103-104; A. MacCormick, pp.110-112"
1983.07.25.a,25-Jul-1983,1983,Sea Disaster,AUSTRALIA,Queensland,"Off Lodestone Reef, Great Barrier Reef, north of Townsville",14 m prawn trawler New Venture capsized  & sank in heavy seas Three people in the water,M,28,"Left knee bitten, but survived",N,night,"H. Edwards, pp.103-104; A. MacCormick, pp.110-112 "
1983.07.15,15-Jul-1983,1983,Unprovoked,SOUTH AFRICA,Eastern Cape Province,"Seal Point, Cape St. Francis",Surfing,M,,Left arm injured by shark's tail as it swam beneath his board,N,,"M. Levine, GSAF"
1983.07.12.b,12-Jul-1983,1983,Unprovoked,USA,Florida,"Caloosahatchee River, Lee County",Windsurfing,F,39,Left ankle nipped (3 punctures wounds),N,afternoon,"Miami Herald, 7/14/1983, p.12A"
1983.07.12.a,08-Jul-1983,1983,Unprovoked,BAHAMAS,Abaco Islands,Green Turtle Cay,Spearfishing,M,13,Lacerations to left calf,N,morning,"Miami Herald, 7/13/1983, p.2D"
1983.07.05,05-Jul-1983,1983,Unprovoked,USA,Florida,"Riviera Beach, Palm Beach County",Floating on air mattress,M,17,"No injury, shark bit air mattress, deflating it",N,,"E.Pace, FSAF"
1983.06.29,29-Jun-1983,1983,Unprovoked,USA,Florida,"Off 12th Street, Miami Beach",Swimming,M,42,Left foot bitten,N,morning,"Miami Herald, 6/30/1983, "
1983.06.22,22-Jun-1983,1983,Unprovoked,BAHAMAS,Abaco Islands,"Off Sandy Point, Great Abaco Island",Spearfishing,M,15,FATAL,Y,afternoon,"Chicago Tribune, 8/21/1983, p.B7"
1983.06.20,20-Jun-1983,1983,Unprovoked,USA,Florida,"Cocoa Beach, Brevard County",Surfing & dangling foot in water amid baitfish,M,21,Left foot lacerated,N,afternoon,"Miami Herald, 6/22/1983, p.2B"
1983.06.15,15-Jun-1983,1983,Unprovoked,BAHAMAS,,Carter Cay,,M,30,Lacerations to hand & foot,N,morning,"E.  Pace, FSAF"
1983.06.15,15-Jun-1983,1983,Invalid,ITALY,Northwest Italy,Riomaggiore (Ligura),Scuba diving,M,,"No injury, 3 m shark ""harassed"" him at depth of 5 m",,,MEDSAF
1983.06.00,June 1983,1983,Unprovoked,BAHAMAS,Berry Islands,Whale Cay,Spearfishing,M,,Lacerations to thigh & buttocks,N,afternoon,"E. Pace, FSAF & M. Levine, GSAF"
1983.05.31,31-May-1983,1983,Unprovoked,USA,Florida,"Intracoastal Waterway, Boca Raton, Palm Beach County",Water-skiing,M,21,"Left calf, knee & hands lacerated",N,,"E. Pace; Miami Herald, 6/2/1983, p.10A"
1983.05.24,24-May 1983,1983,Unprovoked,USA,Florida," Riviera Beach, Palm Beach County",Surfing,M,15,"Knocked off board by shark, no injury",N,,"E. Pace, FSAF"
1983.05.21,21-May-1983,1983,Unprovoked,USA,Florida,"Haulover Inlet, Dade County",Surfing,M,22,Right foot bitten,N,afternoon,"The Palm Beach Post, 3/15/1989;  Miami Herald, 5/22/1983 & 3/15/1989"
1983.04.12,12-Apr-1983,1983,Unprovoked,SOUTH AFRICA,Eastern Cape Province,Bonza Bay,Fishing,M,27,Puncture wounds to foot,N,afternoon,"R. Horn, East London Aquarium; Natal Witness, 4/14/1983"
1983.04.02.b,02-Apr-1983,1983,Unprovoked,USA,Florida,"Lake Worth Beach, Palm Beach County",Surfing,M,16,Left foot bitten,N,morning,"Miami Herald, 4/3/1983, p.2D"
1983.03.30.a,30-Mar-1983,1983,Unprovoked,SOUTH AFRICA,KwaZulu-Natal,Scottburgh,Spearfishing,M,17,Right calf lacerated,N,morning,"W. Johnson, M. Levine, GSAF; G. Charter, B. Davis, G. Cliff, NSB; T. Wallett, pp.65-66"
1983.03.22,22-Mar-1983,1983,Unprovoked,SOUTH AFRICA,Eastern Cape Province,Nahoon,Surfing,M,,"No injury, board bitten",N,morning,"G. Cliff, NSB"
1983.03.10,10-Mar-1983,1983,Unprovoked,USA,Florida,"Juno Beach, Palm Beach County",Surfing,M,,"Shark nudged board, no injury",N,,"M. Vorenberg, GSAF"
1983.02.20,20-Feb-1983,1983,Unprovoked,SOUTH AFRICA,KwaZulu-Natal,Mtunzini,Paddleskiing,M,16,Puncture wounds to buttocks,N,morning,"G. Charter, B. Davis & G. Cliff; Natal Mercury 2/22/1983"
1983.01.24,24-Jan-1983,1983,Provoked,USA,South Carolina,60 miles southeast of Beaufort,Fishing,M,43,Leg bitten by captive shark PROVOKED INCIDENT,N,,"Wilmington MorningStar, 1/25/1983"
1983.01.10,10-Jan-1983,1983,Unprovoked,SOUTH AFRICA,Western Cape Province,Muizenberg,Windsurfing,M,22,Left foot lacerated,N,afternoon,"Mrs. Crewe, B. Lipschitz, M. Levine, GSAF"
1983.01.08,08-Jan-1983,1983,Unprovoked,SOUTH AFRICA,Western Cape Province,Holbaai,Spearfishing,M,32,"No injury, rammed by shark",N,morning,"P. deBruyn, M. Levine, GSAF"
1983.00.00.c,1983,1983,Unprovoked,VANUATU,Malampa Province,"Off the beach opposite Atchin Island, Malakula",Ran into the water,M,,"FATAL, arm/shoulder severed ",Y,,S. Combs
1983.00.00.b,1983,1983,Provoked,USA,North & South Carolina,,Fishing,M,,Bitten on their feet by landed sharks / lacerations only PROVOKED INCIDENTS,N,,F. Schwartz
1982.11.00,Nov-1982,1982,Unprovoked,USA,South Carolina,"Isle of Palms, Charleston County",In waist-deep water,M,,Arm bitten,N,, F. Schwartz
1982.10.13,13-Oct-1982,1982,Unprovoked,USA,Florida,North Dade- Interama area of Biscayne Bay,Windsurfing,M,26,Left foot lacerated,N,morning,"P. Hamm, Miami Herald, 10/15/1982"
1982.09.30.b,30-Sep-1982,1982,Unprovoked,SOUTH AFRICA,Eastern Cape Province,"Nahoon, East London",Surfing,M,16,"No injury, pressure ding on surfboard",N,afternoon,"R. Horn, E.L. Aquarium"
1982.09.30.a,30-Sep-1982,1982,Unprovoked,SOUTH AFRICA,Eastern Cape Province,"Nahoon, East London",Surfing,M,16,"No Injury, surfboard bitten",N,afternoon,"M. Levine, GSAF; R. Horn, E.L. Aquarium; T. Wallett, p.46-47"
1982.09.27,27-Sep-1982,1982,Unprovoked,USA,Florida,"Patrick Air Force Base, Brevard County",Surfing,M,20,Laceration to lower left leg,N,morning,"Miami Herald, 9/28/1982"
1982.09.25,25-Sep-1982,1982,Unprovoked,USA,California,"Monastery Beach, Carmel Bay, Monterey County",Diving,M,36,Lacerations to hand,N,morning,R. Collier
1982.09.19,19-Sep-1982,1982,Unprovoked,USA,California,"Bear Harbor, Mendocino County",Free diving for abalone from Zodiac (submerged),M,28,Upper left thigh & buttocks bitten,N,afternoon,"R.N. Lea & D. Miller; Herder, p. 1-3; R. Collier, pp.89-91; A. MacCormick, pp.80-81"
1982.09.04,04-Sep-1982,1982,Invalid,USA,Florida,"Hollywood Beach, Broward County",,M,20,"Remains recovered from 2.7 m tiger shark, but shark involvement prior to death unknown",,,"Z. Arocha, Miami Herald, 9/5/1982"
1982.08.29.b,29-Aug-1982,1982,Invalid,USA,California,"Morro Rock, Morro Bay, San Obispo County",Surfing,M,17,"No Injury, board bitten",,morning,"R.N. Lea & D. Miller; R. Collier, pp.87-89      "
1982.08.29.a,29-Aug-1982,1982,Unprovoked,SOUTH AFRICA,Western Cape Province,Langebaan,Swimming,F,18,"Left knee, lower leg & foot bitten",N,morning,"V. Keet, M. Levine, GSAF"
1982.08.00,Late Aug-1982,1982,Unprovoked,TUNISIA,,"Skanes, near Monaster",Windsurfing,M,,Thigh lacerated,N,,MEDSAF
1982.07.31,31-Jul-1982,1982,Invalid,SOUTH AFRICA,KwaZulu-Natal,Amanzimtoti,Boogie boarding,M,20,"No injury, swim fin bitten",,afternoon,"M. Levine, GSAF"
1982.07.24.b,24-Jul-1982,1982,Unprovoked,SOUTH AFRICA,Eastern Cape Province,"Nahoon, East London",Paddleskiing,M,38,"No injury, ski bitten",N,afternoon,"B. Plumb, M. Levine, GSAF; R. Horn, E.L. Aquarium; T. Wallett, p.46"
1982.07.24.a,24-Jul-1982,1982,Unprovoked,USA,California,"Point Buchon, San Luis Obispo County",Paddle Boarding,M,26,"No Injury, board bitten",N,morning,"R.N. Lea & D. Miller; R. Collier, pp.86-87; G. Ambrose, pp.113-120"
1982.07.19,19-Jul-1982,1982,Unprovoked,USA,Florida,"Stuart Beach, Martin County ",Swimming,M,17,Left ankle bitten,N,,"Miami Herald, 7/21/1982, p.1D"
1982.07.11, 11-Jul-1982,1982,Invalid,USA,California,"Malibu, Los Angeles County",Swimming,M,43,Laceration to left thigh,,,"Chronicle Telegram, 7/12/1982, p.A4; Daily Herald , 7/13/1982"
1982.07.01,01-Jul-1982,1982,Unprovoked,USA,Florida,"Daytona Beach, Volusia County",Swimming,F,19,Laceration to left leg,N,afternoon,"Daytona Beach Morning Journal, 7/2/1982"
1982.06.29,29-Jun-1982,1982,Unprovoked,SOUTH AFRICA,Eastern Cape Province,Ntlonyana Bay,Surfing,M,27,FATAL,Y,morning,"M. Levine, GSAF; R.B. Wilson, B. Davis, NSB; T. Wallett, p.46"
1982.06.26.b,26-Jun-1982,1982,Unprovoked,USA,South Carolina,"Isle of Palms, Charleston County",Swimming,M,20,Left arm bitten,N,afternoon,"Chillicothe Constitution Tribune, 6/30/1982"
1982.06.26.a,26-Jun-1982,1982,Unprovoked,BAHAMAS,Andros Islands,North Rat Cay Reef,Spearfishing ,M,19,Arm severed at elbow,N,,"R. Attrill; R.D. Weeks, GSAF"
1982.06.25,  25-Jun-1982,1982,Unprovoked,USA,Florida,"Ormond Beach / Daytona Beach, Volusia County",,F,8,Foot bitten,N,morning,"Wellsboro Gazette, 6/30/1982"
1982.06.13,13-Jun-1982,1982,Unprovoked,USA,Hawaii,"Ho'okipa Beach, Pa'ia, Maui","Sailboarding, fell into water 100 yards outside the breakwater",M,,Thigh bitten 3 times,N,,"J. Borg, p.76; L. Taylor (1993), pp.106-107; Windsurfing Magazine, Sept/Oct 1993"
1982.05.00,May 1982,1982,Invalid,USA,South Carolina,"Daws Island, Broad River (near Beaufort)",,F,33,Human remains recovered from tiger shark,,,"Clay Creswell, GSAF"
1982.03.10,10-Mar-1982,1982,Unprovoked,USA,Florida,"Palm Beach, Palm Beach County",Surfing,M,16,Elbow bitten,N,afternoon,"M. Vorenberg, GSAF"
1982.03.07,07-Mar-1982,1982,Unprovoked,AUSTRALIA,New South Wales,"Tallow Beach, Byron Bay",Surfing,M,20,Legs bitten  FATAL,Y,morning,"A. Sharpe, pp.4, 86-87"
1982.02.28,28-Feb-1982,1982,Unprovoked,AUSTRALIA,Tasmania,South Cape Bay,Spearfishing,M,32,"FATAL, body not recovered",Y,,"C. Black, pp. 159-163"
1982.02.27,27-Feb-1982,1982,Unprovoked,USA,Florida,"Hobe Sound, Palm Beach County",Surfing,M,18,Lacerations to left hand and forearm,N,,"Palm Beach Post, 3/2/1982   "
1982.02.17,17-Feb-1982,1982,Provoked,SOUTH AFRICA,Western Cape Province,Mossel Bay,Fishing,M,,Leg bitten above ankle by hooked shark taken aboard skiboat PROVOKED INCIDENT,N,,"Mossel Bay Advertiser, 2/19/1982"
1982.02.14.b,14-Feb-1982,1982,Unprovoked,USA,Hawaii,"White Plains Beach, Barbers Point, O'ahu",Wading,F,,Left leg bitten,N,,"J. Borg, p.75; L. Taylor (1993), pp.104-105"
1982.02.14.a,14-Feb-1982,1982,Unprovoked,USA,Hawaii,"White Plains Beach, Barbers Point, O'ahu",Swimming,F,,Right foot bitten,N,,"J. Borg, p.75; L. Taylor (1993), pp.104-105"
1982.02.13,13-Feb-1982,1982,Unprovoked,USA,Florida,"Palm Beach, Palm Beach County",Swimming,F,75,Shark-bitten body found floating 1.5 miles offshore. Bruises suggested she may have been bitten by the shark before drowning,Y,morning,"M. Vorenberg, GSAF"
1982.02.07.a,07-Feb-1982,1982,Unprovoked,USA,California,"Stillwater Cove, Sonoma County",Scuba diving (submerged),M,,Calf & ankle bitten,N,morning,"R.N. Lea & D. Miller; R. Collier, p.86"
1982.02.07..b,07-Feb-1982,1982,Unprovoked,USA,Florida,Elliot Key,Diving,M,29,"FATAL Disappeared while diving, bathing suit & diving gear recovered bore marks of shark's teeth",Y,,"Miami Herald, 9/5/1982, p.1B"
1982.01.29,29-Jan-1982,1982,Unprovoked,SOUTH AFRICA,Eastern Cape Province,Mpekeweni,Swimming,M,20,Right shin & toe lacerated,N,afternoon,"J. Phillips-Page, M. Levine, GSAF"
1982.00.00.c,1982,1982,Boating,ITALY,Tyrrhenian Sea,"Lacona, Isola d'Elba",Boat,M,,No details,UNKNOWN,,"A. De Maddalena; Perfetti (1989), M. Zuffa (pers. Comm.)"
1982.00.00.b,1982,1982,Boating,ITALY,Tyrrhenian Sea,"Biodola, Isola d'Elba",Fishing on a boat,M,,No injury,N,,"A. De Maddalena; Perfetti (1989), M. Zuffa (pers. Comm.)"
1981.12.19,19-Dec-1981,1981,Unprovoked,USA,California,"South Moss Beach, Spanish Bay, Monterey Peninsula",Surfing,M,24,"FATAL, torso bitten ",Y,,"R.N. Lea & D. Miller; R. Collier, pp.84-85; A. MacCormick, p.220"
1981.12.13.a,13-Dec-1981,1981,Unprovoked,USA,Hawaii,"Nimitz Beach, Barbers Point, O'ahu","Spearfishing, but swimming on surface",M,,Right leg severely bitten,N,,"J. Borg, p.75; L. Taylor (1993), pp.104-105"
1981.11.30,30-Nov-1981,1981,Unprovoked,REUNION,Saint-Philippe,Vicendo,Spearfishing,M,,Survived,N,,G. Van Grevelynghe
1981.10.19.b,19-Oct-1981,1981,Provoked,SOUTH AFRICA,Western Cape Province,Mossel Bay,Inspecting teeth of supposedly dead (hooked & shot) shark,M,,Hand lacerated  PROVOKED INCIDENT,N,,"M. Levine, GSAF"
1981.11.09,09-Nov-1981,1981,Unprovoked,USA,Hawaii,"La'au Point, Moloka'i",Diving to untangle a crab trap line from boat's propeller,M,59,Hand bitten,N,,"J. Borg, p.75; L. Taylor (1993), pp.104-105"
1981.10.19.a,19-Oct-1981,1981,Unprovoked,USA,Florida,"Jupiter Island, Brevard County",Swimming,M,19,Hand & forearm bitten,N,morning,"Chronicle Telegram, 10/20/1981 "
1981.10.17,17-Oct-1981,1981,Unprovoked,USA,Florida,"Palm Beach, Palm Beach County",Surfing,M,,No details,UNKNOWN,morning,"M. Vorenberg, GSAF"
1981.10.16,16-Oct-1981,1981,Unprovoked,USA,Florida,"Cocoa Beach, Brevard County",Surfing,M,17,Puncture wounds to left foot,N,,"The Bulletin, 10/19/1981"
1981.10.01,01-Oct-1981,1981,Unprovoked,USA,Florida,"Playalinda Beach, Brevard County",Surfing,M,24,Laceration to right leg,N,,"St. Petersburg Times, 10/3/1981"
1981.09.28,28-Sep-1981,1981,Unprovoked,USA,Florida,"Cocoa Beach, Brevard County",Surfing,M,28,5 puncture marks to hip,N,afternoon,"St. Petersburg Times, 10/1/1981"
1981.09.27,27-Sep-1981,1981,Unprovoked,USA,Florida,"Melbourne Beach, Brevard County",Surfing,M,,Lacerations to right hand,N,,"Sarasota Herald-Tribune, 9/29/1981"
1981.09.15,15-Sep-1981,1981,Unprovoked,USA,Florida,"Tampa Bay, Manatee County",Swimming,M,26,"FATAL, right calf bitten  ",Y,,"S. Pelham, M.D.; NY Times, 9/21/1981, p.18, col.1; E. Pace, FSAF"
1981.09.03.b,03-Sep-1981,1981,Unprovoked,USA,Florida,"Patrick Air Force Base, Brevard County",Surfing,M,25,Lacerations to 2 fingers of left hand,N,morning,"St Petersburg Times, 9/5/1981"
1981.09.03.a,03-Sep-1981,1981,Unprovoked,USA,Florida,"Cocoa Beach, Brevard County",Surfing,M,24,Laceration to foot,N,morning,"St Petersburg Times, 9/5/1981"
1981.08.29,29-Aug-1981,1981,Unprovoked,USA,Florida,"New Smyrna Beach, Volusia County",Surfing,M,15,Laceration to left ankle,N,,"Pacific Stars and Stripes, 8/31/1981 "
1981.08.24.b,24-Aug-1981,1981,Provoked,USA,Florida,Gulf Island National Seashore Park,Spearfishing,M,19,"Shot shark, then it bit him. Puncture wounds on leg  PROVOKED INCIDENT",N,,"A. MacCormick, pp.82-83, citing the New Orleans Times-Picayune, 8/25/1981"
1981.08.24.a,24-Aug-1981,1981,Invalid,USA,Hawaii,"Keaukaha, Hilo, Hawai'i",Fishing,M,,Disappeared while fishing from shore. Leg found 7 days later wedged in rocks 150 yards offshore,,,"J. Borg, p.75; L. Taylor (1993), pp.104-105"
1981.08.10.b,10-Aug-1981,1981,Unprovoked,USA,Florida,"Marathon, Monroe County",Diving,M,,Bite to face,N,,"E. Pace, FSAF"
1981.08.10.a,10-Aug-1981,1981,Unprovoked,USA,Florida,"Ormond Beach / Daytona Beach, Volusia County","16' catamaran capsized previous night, occupants stayed with wreckage until morning, then attempted to swim ashore",F,19,FATAL,Y,,"E. Pace, GSAF; J. McAniff, SAF; A. MacCormick, pp.12 & 13; Orlando Sentinel, 12/6/1985; K Duffy, Daytona Beach News Journal, 8/26/2001"
1981.08.07,07-Aug-1981,1981,Unprovoked,BAHAMAS,Grand Bahama Island,"Gingerbread Reef, east of Little Isaac Island ",Snorkeling on surface,M,53,Upper right arm bitten,N,morning,"R. Marx, E. Clark; M. Levine, GSAF; Note: Marx says the incident took place in 8/8/1982 or 1983"
1981.07.20,20-Jul-1981,1981,Unprovoked,USA,Florida,"St. Petersburg Beach, Pinellas County",Swimming,F,16,"Foot bitten between arch & big toe, no stitches required",N,,"E. Pace, GSAF"
1981.07.18,18-Jul-1981,1981,Unprovoked,SOUTH AFRICA,Eastern Cape Province,Nahoon,Surfing,M,32,7 lacerations to right foot,N,morning,"B. V.D. Helm; R. Horn; M. Levine, GSAF"
1981.07.07,07-Jul-1981,1981,Unprovoked,USA,Florida,Carter Cay,Spearfishing,M,,Left foot & ankle lacerated,N,afternoon,"E. Pace, GSAF"
1981.07.01,01-Jul-1981,1981,Unprovoked,SOUTH AFRICA,KwaZulu-Natal,Clansthal,Catching sardines,M,,Laceration to calf,N,,"Chronicle Telegram, 7/1/1981"
1981.06.15.R,Reported 15-Jun-1981,1981,Boating,ENGLAND,,Isle of Wight,Fishing,M,,Minor injuries from shark that leapt aboard their boat,N,,"The Times (London), 6/15/1981"
1981.05.24,24-May-1981,1981,Unprovoked,USA,Hawaii,"Ha'ena Beach Park, Kaua'i","Scuba diving, reportedly also spearfishing",M,,"FATAL, disappeared, dive gear & shredded tooth-marked wetsuit were recovered",Y,,"J. Borg, p.87; L. Taylor (1993), pp.104-105"
