Case Number,Date,Year,Type,Country,Area,Location,Activity,Sex,Age,Injury,Fatal,Time,Investigator or Source
2006.05.28,28-May-2006,2006,Provoked,USA,Hawaii,French Frigate Shoals,Tagging sharks,,,"No injury to occupants, boat damaged by hooked shark PROVOKED INCIDENT",N,afternoon,"Honolulu Advertiser, 5/29/2006"
2006.05.27,27-May-2006,2006,Unprovoked,USA,Hawaii,"North Shore, O'ahu",Surfing,M,31,"No injury, shark bumped surfboard",N,afternoon,R. Collier
2006.05.24,24-May-2006,2006,Provoked,USA,Hawaii,Lanai,Spearfishing,M,15,Knee bitten after diver poked shark PROVOKED INCIDENT,N,afternoon,"Maui News, 5/26/2006"
2006.05.21,21-May-2006,2006,Unprovoked,BRAZIL,Pernambuco,"Boa Viagem Beach, Recife",Surfing,M,33,"Injuries to left thigh, calf & foot",N,morning,"Avisa Nordland, 5/22/2006"
2006.05.19,19-May-2006,2006,Unprovoked,USA,Guam,Gun Beach,Scuba diving,F,30,Laceration to leg,N,afternoon,R. Segal
2006.05.10,05-May-2006,2006,Unprovoked,USA,Florida,"Cocoa Beach, Brevard  County",,M,,Small lacerations to arm,N,morning,"Florida Today, 5/10/2006"
2006.05.04,04-May-2006,2006,Unprovoked,USA,Florida,"Hutchinson Island, St. Lucie County",Swimming,F,20,2 lacerations on lower right leg,N,afternoon,"TCPalm.com, 5/4/2006 "
2006.05.02,02-May-2006,2006,Provoked,AUSTRALIA,Queensland,"Moffat Beach, Caloundra",Snorkeling,M,46,Abrasion & 6 puncture wounds on chest after grabbing the shark by its tail PROVOKED INCIDENT,N,afternoon,"Sunshine Coast Daily, 5/4/2006"
2006.04.21,21-Apr-2006,2006,Unprovoked,USA,Florida,"Sebastian Inlet, Brevard County",Surfing,M,54,Feet bitten,N,,Local 6 News
2006.04.19,19-Apr-2006,2006,Unprovoked,USA,Florida,"Daytona Beach, Volusia County",Standing,F,13,3 tiny punctures & small lacerations on right ankle,N,afternoon,"Orlando Sentinel, 4/20/2006; Yahoo News;  S. Petersohn"
2006.04.13,13-Apr-2006,2006,Provoked,USA,Florida,"Port of the Islands, Collier County",Fishing,M,35,3 to 4 cm laceration on foot from hooked shark brought on board PROVOKED INCIDENT,N,afternoon,"Naples News, 4/13/2006"
2006.04.11,11-Apr-2006,2006,Unprovoked,AUSTRALIA,New South Wales,Newcastle Beach,Surfing,M,15,Minor laceration to left foot,N,morning,"Daily Telegraph, 4/12/2006"
2006.04.09.b,09-Apr-2006,2006,Unprovoked,SOUTH AFRICA,Eastern Cape Province,St. Francis Bay,Body boarding,M,15,Leg bitten,N,afternoon,J. Visser
2006.04.09.a,09-Apr-2006,2006,Unprovoked,BRAZIL,Pernambuco,Piedade,Swimming,M,35,Left leg bitten,N,afternoon,"Diario de Pernambuco, 4/10/2006"
2006.04.03,03-Apr-2006,2006,Unprovoked,USA,Florida,"Marco Island, Collier County",Wading,M,11,Minor injury to right hand & thigh,N,morning,CBS Broadcasting
2006.03.28.R,Reported  28-Mar-2006,2006,Unprovoked,Sierra Leone,Western Area,"Lumely Beach, Freetown",Fishing,M,,Reportedly FATAL but few details,Y,,Reuters
2006.03.23,23-Mar-2006,2006,Unprovoked,USA,Hawaii,"Leftovers, near Waimea Bay, O'ahu",Surfing,F,28,5 puncture wounds in left calf,N,morning,Honolulu Advertiser
2006.03.22,22-Mar-2006,2006,Invalid,SOUTH AFRICA,Eastern Cape Province,Port Alfred,Swimming,M,17,"FATAL, but shark involvement prior to death unconfirmed",,,"Cape Times, 3/24/2006, p.3"
2006.03.19,18-Mar-2006,2006,Unprovoked,FIJI,Vitu Levu,Sigatoka,Surfing,M,21,Lacerations to right hand,N,afternoon,"R.D. Weeks, GSAF; Fiji Sun, 3/19/2006"
2006.03.15,15-Mar-2006,2006,Unprovoked,AUSTRALIA,New South Wales,"Bondi, Sydney",Surfing,M,15,"No injury, shark nudged surfboard",N,afternoon,"The Australian, 3/15/2006"
2006.02.27,27-Feb-2006,2006,Unprovoked,USA,Hawaii,"Makena, Maui",Standing,F,15,Deep laceration to right calf,N,afternoon,"G.T. Kubota, Star Bulletin, 2/28/2006"
2006.02.23,23-Feb-2006,2006,Invalid,USA,Hawaii,"Makena, Maui",Free diving,M,45,Forensic examination suggested diver drowned & afterwards his body was bitten by a shark/s,,,http://www.kesq.com
2006.02.13,13-Feb-2006,2006,Unprovoked,AUSTRALIA,Queensland,"Golden Beach, Caloundra",Wading,M,18,Lacerations to foot,N,morning,"G. Stolz, Courier-Mail, 2/14/2006"
2006.02.12.b,12-Feb-2006,2006,Unprovoked,AUSTRALIA,Queensland,"Point Vernon, Hervey Bay",Swimming,M,,Puncture wound on arm,N,,"G. Stolz, Courier-Mail, 2/14/2006"
2006.02.12.a,12-Feb-2006,2006,Boating,AUSTRALIA,South Australia,"Brighton Beach, Adelaide",Fishing,M,,No injury to occupants; shark nudged the 5.3 m boat,N,morning,Port Adelaide Football Club
2006.02.08,08-Feb-2006,2006,Unprovoked,SOUTH AFRICA,Eastern Cape Province,"Nahoon, East London",Surfing,M,15,2 bite marks on right calf,N,,"M. Kabeli, Dispatch Online.com; G. Brett & K. Cole, EL Museum"
2006.02.01.b,01-Feb-2006,2006,Unprovoked,TONGA,Vava'u,Tuanuku,Swimming,F,24,Severe bite to right leg FATAL,Y,afternoon,D. Clem; www.matangitonga.to
2006.02.01.a,01-Feb-2006,2006,Boating,USA,Hawaii,"Off Pu'u Ola'l, Makena, Maui",Kayaking,M,57,No injury to occupant; shark bumped the kayak repeatedly for 15 minutes,N,afternoon,"R. Collier, GSAF; Honolulu Advertiser, 2/1/2006"
2006.01.28.R,Reported 28-Jan-2006,2006,Boating,ATLANTIC OCEAN,300 miles from Antigua,,Competing in the Woodvale Atlantic Rowing Race,M,40,No injury to occupants; shark rammed boat repeatedly,N,,"N. Bevan, icwales.icnetwork.co.uk, 1/28/2006"
2006.01.25,25-Jan-2006,2006,Unprovoked,SOUTH AFRICA,Eastern Cape Province,Coffee Bay,Spearfishing,M,34,Right arm  bitten,N,afternoon,"Geremy Cliff, NSB"
2006.01.23,23-Jan-2006,2006,Boating,ATLANTIC OCEAN,800 miles from land,,Competing in the Woodvale Atlantic Rowing Race,F,27,"No injury to occupants; a shark, accidentally caught in a line, threatened to rip out the transom",N,,"Northants News, 1/25/2006"
2006.01.18,18-Jan-2006,2006,Unprovoked,USA,California,"Santa Cruz, Santa Cruz County",Night Surfing,M,,"No injury, but 2 small nicks on wetsuit",N,,R. Collier
2006.01.15,15-Jan-2006,2006,Unprovoked,AUSTRALIA,Western Australia,"Off City Beach, Perth",Scuba diving,M,52,Lacerations to left elbow,N,morning,"T. Peake, GSAF"
2006.01.11,11-Jan-2006,2006,Invalid,BAHAMAS,Grand Bahama Island,Sandy Cay,Diving for lobsters,M,,"No injury, divers felt threatened by 10' pregnant female tiger shark & killed the shark",,morning,"Bahama Journal, 1/13/2006"
2006.01.07,07-Jan-2006,2006,Unprovoked,AUSTRALIA,Queensland,"Amity Point, North Stradbroke Island",Swimming,F,21,FATAL,Y,afternoon,"T. Peake, GSAF"
2006.01.04,04-Jan-2006,2006,Unprovoked,USA,Florida,"Round Island Park, Indian River County",Surfing,M,21,3 puncture wounds in right wrist & hand,N,afternoon,"A. Neal, scripps.com"
2006.01.01,01-Jan-2006,2006,Unprovoked,SOUTH AFRICA,Western Cape Province,Soetwater,Diving for crayfish,M,49,Lacerations to little finger,N,,"J.P. Botha, GSAF"
2005.12.24,24-Dec-2005,2005,Unprovoked,USA,Oregon,"Tillamook Head, Clatsop County",Surfing,M,30,Lacerations to ankle & calf,N,morning,"R. Collier, GSAF; L.A. Times, 12/25/2005"
2005.12.21,21-Dec-2005,2005,Unprovoked,USA,Hawaii,"Keawakapu Beach, Maui",Swimming,M,29,Left hand bitten,N,morning, San Francisco Gate 2/21/2005
2005.12.20,20-Dec-2005,2005,Boating,ATLANTIC OCEAN,600 nm west of the Canary Islands,,Competing in the Woodvale Atlantic Rowing Race,,,"No injury to occupants, shark rammed boat for 15 minutes",N,morning,"R.D. Weeks, GSAF; NZ Herald, 12/21/2005"
2005.12.11,11-Dec-2005,2005,Unprovoked,AUSTRALIA,Queensland,St. Crispin Reef,Spearfishing,M,44,Right forearm & elbow bitten,N,morning,"Courier-Mail, 12/12/2005"
2005.12.05.R,Reported 06-Dec-2005,2005,Boating,AUSTRALIA,South Australia,"Middle Beach, 40 km north of Adelaide",Fishing,,,"No injury to occupants, hydrofoil of outboard motor bitten ",N,afternoon,"Melbourne Herald Sun, 12/5/2005"
2005.11.29.R,Reported 29-Nov-2005,2005,Unprovoked,USA,Florida,"Cape San Blas, Gulf County",Surfing,M,,Left foot bitten,N,,wpmi.com
2005.11.27,27-Nov-2005,2005,Unprovoked,USA,Florida,"Ponce Inlet, New Smyrna Beach, Volusia County",Surfing,M,23,Right thumb & palm lacerated,N,morning,"S. Petersohn, GSAF"
2005.11.25.c,25-Nov-2005,2005,Boating,AUSTRALIA,Victoria,"6 km off Collendina, south of Melbourne",Fishing,,,"No injury to occupant, shark bit outboard motor",N,,"Sunday Mail (QLD), 11/27/2005, p.30"
2005.11.25.b,25-Nov-2005,2005,Unprovoked,AUSTRALIA,Victoria,Flinders,Surfing,M,18,"2 lacerations on leg, each 4"" to 5"" long",N,afternoon,"Sydney Morning Herald, 11/25/2005"
2005.11.25.a,25-Nov-2005,2005,Unprovoked,SOUTH AFRICA,Eastern Cape Province,"Nahoon, East London",Surfing,M,26,"Cut on finger, board bitten",N,morning,Dispatch online
2005.11.24,24-Nov-2005-,2005,Unprovoked,NEW CALEDONIA,Loyalty Islands,Maré,Spearfishing,,,Arm bitten,N,afternoon,"Les Nouvelles Caledoniennes, 11/29/2005"
2005.11.21,21-Nov-2005,2005,Unprovoked,USA,Florida,"Jensen Beach, Martin County ",Surfing,M,30,Left foot bitten,N,afternoon,Stuart News
2005.11.20,20-Nov-2005,2005,Unprovoked,USA,Florida,"New Smyrna  Beach, Volusia County",Surfing,M,17,Lacerations to right thigh,N,afternoon,"S. Petersohn, GSAF"
2005.11.15,15-Nov-2005,2005,Provoked,SOUTH AFRICA,Eastern Cape Province,Aston Bay,Fishing for sharks,M,32,Lacerations to hands & right leg when he tried to pull shark from the water PROVOKED INCIDENT,N,afternoon,J. Visser
2005.11.12,12-Nov-2005,2005,Unprovoked,USA,Florida,"New Smyrna  Beach, Volusia County",Surfing,M,18,Puncture wounds to right foot,N,morning,"S. Petersohn, GSAF"
2005.11.02.b,02-Nov-2005,2005,Unprovoked,USA,California,"Mavericks, Half Moon Bay, San Mateo County",Surfing,M,25,"No injury, board bitten",N,afternoon,"R. Collier, GSAF"
2005.11.02.a,02-Nov-2005,2005,Unprovoked,USA,California,"Ocean Beach, San Francisco, San Francisco County",Surfing,M,26,"No injury, board bumped",N,morning,"R. Collier, GSAF"
2005.10.29,29-Oct-2005,2005,Unprovoked,USA,Florida,"Ponce de Leon Inlet, Volusia County ",Wading,M,15,Puncture wounds to foot,N,,"Sentinel, 1-/30/2005"
2005.10.25,25-Oct-2005,2005,Unprovoked,ST. MAARTIN,Simpson Bay,Sunterra Beach,Standing,M,55,Lower right leg lacerated,N,morning,"M. Levine, GSAF"
2005.10.22,22-Oct-2005,2005,Unprovoked,SOUTH AFRICA,Western Cape Province,Uilenkraalsmond (near Gansbaai),Standing / Surfing,M,20,Right foot bitten,N,morning,Cape Times
2005.10.21,21-Oct-2005,2005,Unprovoked,USA,California,"Klamath River mouth, Del Norte County",Surfing,M,36,No injury,N,morning,"R. Collier, GSAF"
2005.10.19,19-Oct-2005,2005,Unprovoked,USA,California,"Salmon Beach, Sonoma County",Surfing,F,20,Leg bitten,N,morning,"R. Collier, GSAF; Bay City Newswire"
2005.10.15,15-Oct-2005,2005,Provoked,USA,Florida,"Ponce Inlet, Volusia County",Wading,M,15,Minor cuts to dorsum & sole of left foot when he stepped on shark PROVOKED INCIDENT,N,afternoon,"S. Petersohn, GSAF; Florida Today, 10/16/2005 "
2005.10.13,13-Oct-2005,2005,Unprovoked,USA,Hawaii,"Honokowai, Maui",Surfing,M,22,"No injury, surfboard bitten",N,afternoon,Hawaii Department of Land and Natural Resources
2005.10.11,11-Oct-2005,2005,Unprovoked,GRAND CAYMAN,East Wall,Jack McKenney's Canyon,Scuba diving,F,57,No injury ,N,afternoon,"L.A.Hughes; G. Holt, Scubaradio.com"
2005.10.06,06-Oct-2005,2005,Unprovoked,USA,Florida,"Ponce Inlet, Volusia County",Treading water/ Surfing,M,48,Five 1-inch lacerations to left foot,N,afternoon,"S. Petersohn, GSAF"
2005.10.03,03-Oct-2005,2005,Unprovoked,BAHAMAS,Abaco Islands,Grand Cay,Diving,M,35,Lacerations to right side of face,N,,"E. Ritter, GSAF; A. Armbrister, Freeport News, 10/3/2005"
2005.10.01,01-Oct-2005,2005,Unprovoked,SOUTH AFRICA,Western Cape Province,"Sunny Cove, Fish Hoek",Surf-skiing,M,52,"No injury, shark bit ski",N,afternoon,"Cape Argus, Cape Times, 10/3/2005"
2005.09.27.R,Reported      27-Sep-2005,2005,Unprovoked,AUSTRALIA,New South Wales,Arakoon's Little Bay,Surfing,M,28,"No injury, knocked off board",N,,"Macleay Argues, 9/27/2005"
2005.09.24,24-Sep-2005,2005,Unprovoked,AUSTRALIA,South Australia,Kangaroo Island,Surfing,M,26,Lacerations to legs,N,morning,"T. Peake, GSAF"
2005.09.23,23-Sep-2005,2005,Unprovoked,AUSTRALIA,Western Australia,"Scarborough Beach, Perth",Surfing,M,44, No injury,N,morning,"T. Peake, GSAF"
2005.09.22,22-Sep-2005,2005,Invalid,USA,Florida,"Tigertail Beach, Collier County",Surfing,M,,Lacerations to dorsum of left foot,,morning,"A. Galabinski, Marco Island Sun Times, 9/22/2005"
2005.09.20,20-Sep-2005,2005,Unprovoked,USA,South Carolina,"Myrtle Beach, Horry County",Body surfing,F,68,"Injuries to fingers, calf  & heel",N,afternoon,"C. Creswell, GSAF; K. Galliard,  Sun News, 9/21/2005"
2005.09.11,11-Sep-2005,2005,Unprovoked,USA,South Carolina,Folly Beach,Surfing,M,18,FATAL,Y,afternoon,"Post & Courier, 9/12/2005"
2005.09.07,07-Sep-2005,2005,Unprovoked,AUSTRALIA,New South Wales,"Park Beach, Coff's Harbour",Standing,M,15,Left foot & ankle lacerated,N,,"Sydney Morning Herald, 9/9/2005"
2005.09.05,05-Sep-2005,2005,Unprovoked,USA,North Carolina,"North Topsail Beach, Onslow County",Wading,F,18,Calf severely lacerated,N,afternoon,"Clay Creswell, GSAF"
2005.09.04.a,04-Sep-2005,2005,Unprovoked,AUSTRALIA,South Australia,"Fishery Bay, Eyre Peninsula",Surfing,M,40,Lacerations to right arm & thigh,N,afternoon,"C.Jenkin, Courier-Mail, 9/5/2005"
2005.09.02.b,02-Sep-2005,2005,Unprovoked,USA,Florida,"Ponce Inlet, Volusia County",Standing / Surfing,M,62,Right foot bitten,N,morning,"S. Petersohn, GSAF"
2005.09.02.a,02-Sep-2005,2005,Provoked,THAILAND,,On deck of fishing trawler 100 nautical miles offshore,Removing shark from net,M,21,FATAL PROVOKED INCIDENT,Y,,"Africa online, citing the Bangkok Post"
2005.08.24.b,24-Aug-2005,2005,Unprovoked,AUSTRALIA,South Australia,Glenelg ,Scuba diving,M,23,FATAL,Y,afternoon,"Adelaide Advertiser, 8/26/2005"
2005.08.24.a,24-Aug-2005,2005,Unprovoked,USA,California,"Scripps, LaJolla, San Diego County",Surfing,M,37,Lower right leg lacerated,N,morning,"R. Collier, GSAF                "
2005.08.22,22-Aug-2005,2005,Invalid,USA,South Carolina,"6th Avenue North, Myrtle Beach, Horry County","Boogie boarding, kicked at object in the water",M,17,"Laceration to knee, possibly by a  small blacktip shark",,afternoon,"Clay Creswell, GSAF"
2005.08.21,21-Aug-2005,2005,Unprovoked,USA,South Carolina,"34th Avenue North, Myrtle Beach, Horry County",Swimming,M,8,Bitten underneath left arm,N,morning,"Clay Creswell, GSAF"
2005.08.19,19-Aug-2005,2005,Unprovoked,USA,Texas,Crystal Beach (east of Galveston),Walking,M,12,Left foot bitten,N,afternoon,"Clay Creswell, GSAF; Houston Chronicle, 8/20/2005"
2005.08.12,12-Aug-2005,2005,Unprovoked,USA,North Carolina,"Carolina Beach off Texas Avenue, New Hanover County",Surfing,M,16,Laceration on right wrist & crescent of puncture wounds on  forearm ,N,morning,"C. Creswell, GSAF"
2005.08.06,6-Aug-2005,2005,Unprovoked,USA,South Carolina,"Isle of Palms, Charleston County",Swimming,M,14,Puncture wounds on left foot ,N,morning,"C. Creswell, GSAF"
2005.08.01,1-Aug-2005,2005,Invalid,Seychelles,Inner Islands,Off North Island,Fishing,M,,"FATAL, shark involvement prior to death is unconfirmed",,,D. Rowat
2005.07.27,27-Jul-2005,2005,Unprovoked,USA,Florida,"Off Zelda Boulevard, Daytona Beach, Volusia Countyy",Wading,F,13,Laceration on the back of left hand & toothmarks on wrist,N,afternoon,"D. Salamone, GSAF"
2005.07.23,23-Jul-2005,2005,Unprovoked,USA,Florida,"Ormond Beach, Volusia County",Surfing,M,61,"Right foot: Toes and back of foot, minor injury",N,morning,"D. Salamone, GSAF"
2005.07.22,22-Jul-2005,2005,Invalid,USA,Florida,"Quarter mile south of Ponce de Leon Inlet, Volusia County",Surfing,M,25,"Straight 2.5"" laceration on top of left ankle",,morning,"D. Salamone, GSAF"
2005.07.17.a,17-Jul-2005,2005,Provoked,CHINA,Shanghai,"Ocean World, Changfeng Park",Scuba diving in aquarium tank,M,24,2 small cuts on right ear & head when he collided with the captive shark. PROVOKED INCIDENT,N,,"Shanghai Star, 7/21/2005"
2005.07.15,15-Jul-2005,2005,Unprovoked,USA,North Carolina,"Holden Beach, Brunswick County",Swimming,M,22,Lacerations of left forearm,N,afternoon,"C. Creswell, GSAF"
2005.07.13,13-Jul-2005,2005,Unprovoked,USA,Texas,"Port Bolivar, Galveston County",Holding onto an inflatable boat,F,14,Left foot bitten,N,morning,"C. Creswell, GSAF"
2005.07.01,1-Jul-2005,2005,Unprovoked,USA,Florida,"Boca Grande, Lee County",Standing,M,19,Ankle bitten,N,morning,"E. Ritter, GSAF"
2005.06.27,27-Jun-2005,2005,Unprovoked,USA,Florida,"Cape San Blas, Gulf County",Fishing,M,16,"Leg severely bitten, surgically amputated",N,morning,"E. Ritter, GSAF"
2005.06.25,25-Jun-2005,2005,Unprovoked,USA,Florida,"Destin, Walton County",Swimming with boogie board,F,14,"FATAL, leg bitten",Y,morning,"E. Ritter, GSAF"
2005.06.22,22-Jun-2005,2005,Unprovoked,VANUATU,Malampa Province,Atchin Island off Malakula,Swimming,F,7,FATAL,Y,afternoon,"R.D. Weeks, GSAF; New Zealand Herald, 6/23/2005"
2005.06.21,20-Jun-2005,2005,Unprovoked,MEXICO ,Baja California,San Luis beach,Surfing,M,,Left foot bitten,N,morning,http://www.signonsandiego.com/news/mexico/20050622-1621-mexico-sharkattack.html
2005.06.18,18-Jun-2005,2005,Invalid,USA,Hawaii,Maui,Swimming,M,49,"No injury, 2.1m [7'] tiger shark approached swimmer who repelled it with his fist",,morning,www.mauinews.com
2005.06.16,16-Jun-2005,2005,Unprovoked,USA,Florida,"Howard E. Futch Memorial Park at Paradise Beach, Brevard County",Swimming,M,20,Foot bitten,N,afternoon,Local6.com
2005.06.13,13-Jun-2005,2005,Unprovoked,SOUTH KOREA,South Ch'ungch'ong Province,Dando/Kaeui Island ,Diving,F,38,Knee bitten,N,,"Korea Times, 6/13/2005 "
2005.06.07,07-Jun-2005,2005,Unprovoked,USA,South Carolina,"Kiawah Island, Charleston County",Boogie boarding,F,11,Foot lacerated,N,morning,"C. Creswell, GSAF;  N. Kenney, NewsChannel 19"
2005.06.05,05-Jun-2005,2005,Invalid,USA,New Jersey,"Surf City, Long Beach Island, Ocean County",Surfing,M,17,Dorsum of foot/ankle  injured by surfboard skeg or other inanimate object.,,morning,"Mr. Horton; R. Collier,  R. Fernicola; M. Levine, E. Ritter, GSAF "
2005.06.04,04-Jun-2005,2005,Unprovoked,SOUTH AFRICA,Western Cape Province,Miller's Point,Spearfishing (Free diving),M,22,FATAL,Y,afternoon,News24.com; SABC; H. Steele
2005.06.02,02-Jun-2005,2005,Unprovoked,USA,Texas,"Mustang Island, Corpus Christi",Wading,M,6,Two 2-inch lacerations on right foot,N,morning,KRIS6 News
2005.05.28,28-May-2005,2005,Unprovoked,USA,Florida,Daytona Beach Shores,Swimming,M,33,Left foot bitten,N,afternoon,"Daytona Beach News Journal, 5/29/2005; Orlando Sentinel, 5/30/2005, p.B3"
2005.05.27,27-May-2005,2005,Unprovoked,USA,Florida,"Sand Key Beach, Clearwater, Pinellas County",Crouching in 2' of water,F,,Right arm & torso bitten,N,afternoon,"D.Wilhoit, The Ledger, 5/29/ 2005"
2005.05.25,25-May-2005,2005,Unprovoked,SOUTH AFRICA,Eastern Cape Province,Kei River Mouth,Surfing,M,32,Left buttock  & legs lacerated ,N,morning,"C. Prince, East London Daily Dispatch, 5/26/2005;  SABC News"
2005.05.15,15-May-2005,2005,Unprovoked,AUSTRALIA,Queensland,50 km east of Townsville,Spearfishing,M,,Severe injury to lower leg,N,,"J. Anderson, Townsville Bulletin, 5/21/2005 "
2005.05.14,14-May-2005,2005,Boating,USA,Hawaii,"North Kihei, Maui",Kayaking,,,"No injury, shark bit kayak",N,morning,Hawaii Department of Land and Natural Resources
2005.05.02.R,02-May-2005,2005,Sea Disaster,USA,South Carolina,Off Sullivans Island,Sea Disaster,M,,No injury,N,,"Gaffney Ledger, 5/2/2005"
2005.05.02,02-May-2005,2005,Unprovoked,USA,Hawaii,"Noreiga's, Maui",Surfing,M,47,"No injury, board damaged",N,morning,"T. Hurley, Honolulu Advertiser; L. Fujimoto, Maui News, 5/3/2005 "
2005.04.25,25-Apr-2005,2005,Provoked,AUSTRALIA,New South Wales,Bermagui,Fishing,M,25,Laceration on left thigh PROVOKED INCIDENT,N,,"Brisbane Courier Mail, 4/26/2005"
2005.04.16.b,16-Apr-2005,2005,Unprovoked,AUSTRALIA,Northern Territory,Bremer Island,Spearfishing,M,20,Minor cuts above his right eye,N,,"G. McLean, Northern Territory News; Sunday Territorian, 4/17/2005, p.6"
2005.04.16.a,16-Apr-2005,2005,Unprovoked,AUSTRALIA,New South Wales,Bronte Beach,Surfing,M,40,"No injury, board bitten",N,morning,The Sun; Illwarra Mercury; Yahoo News
2005.04.13,13-Apr-2005,2005,Unprovoked,USA,Florida,"Crescent Beach, Sarasota County",Wading,F,70,Right lower leg bitten,N,,Herald Tribune.com
2005.04.09,09-Apr-2005,2005,Invalid,USA,Florida,"Central Gulf Coast, St. John County",Surfing,M,52,Foot injured ,,,"WTSP TampaBays10.com; First Coast News, April 10, 2005 "
2005.04.07,07-Apr-2005,2005,Unprovoked,USA,Texas,"Isla Blanca Park, South Padre Island, Cameron County",Surfing,M,37,Left foot bitten ,N,afternoon,"G. Ferrario; J. Mendoza, Cameron County Parks; The Herald (Brownsville),  4/11/2005"
2005.04.06,06-Apr-2005,2005,Unprovoked,USA,Florida,"Jacksonville Beach, Duval County",,F,,Left calf injured,N,,WJXT News4Jax.com
2005.04.06,06-Apr-2005,2005,Invalid,HONDURAS,Bay Islands,Utila,SCUBA Diving,F,,"Laceration on siide of calf, small laceration on thigh, large bruise on other leg inside the knee, knuckle of hand abraded",,,"J. Engel, SRI & S. Fox, Deep Blue"
2005.03.28,28-Mar-2005,2005,Unprovoked,SOUTH AFRICA,Western Cape Province,Noordhoek,Surfing,M,32,"Lacerations to right calf, puncture wounds on right foot",N,morning,"ITN, 3/30/2005"
2005.03.25,25-Mar-2005,2005,Unprovoked,VENEZUELA,,Punta Caracas,Surfing,M,,Right leg bitten,N,afternoon,"A. Brenneka, GSAF"
2005.03.19,19-Mar-2005,2005,Unprovoked,AUSTRALIA,Western Australia,"Wreck Point, Abrolhos Islands",Snorkeling,M,26,FATAL,Y,afternoon,"T. Peake, GSAF"
2005.03.12,12-Mar-2005,2005,Provoked,USA,New Mexico,"Albuquerue Aquarium, Albuquerue",Diving in aquarium display tank,M,45,2 punctures on forearm as captive shark collided with diver PROVOKED INCIDENT,N,afternoon,"H. Casman; T. Dukart, KOBTV"
2005.03.10,10-Mar-2005,2005,Invalid,SOUTH AFRICA,KwaZulu-Natal,Isipingo,,M,51,Bites by 2.5 m tiger shark were post mortem,,,"J. Govander, Nokia Sea Rescue, SAPA"
2005.03.09,09-Mar-2005,2005,Provoked,NEW ZEALAND,North Island,"Waiapu River mouth , East Cape",Fishing,M,,"No injury, netted shark dragged them 350 metres out to sea PROVOKED INCIDENT",N,afternoon,"R.D. Weeks, GSAF"
2005.02.26,26-Feb-2005,2005,Unprovoked,AUSTRALIA,Queensland,Brisbane River,Swimming,M,18,Finger bitten,N,,Queensland Times
2005.02.22,22-Feb-2005,2005,Provoked,USA,Florida,"Long Key, Monroe County",Spearfishing,M,,Speared shark bit his chest PROVOKED INCIDENT,N,,http://www.foldabikes.com/CurrentEvents/Story/Florida.html
2005.02.16,16-Feb-2005,2005,Unprovoked,USA,Hawaii,"Rocky Point, north shore of O'ahu",Surfing,M,,"No injury, knocked off board, shark bit board",N,afternoon," R. Collier, GSAF;  T. Winters, Honolulu Advertiser, 2/17/2005 "
2005.02.13,13-Feb-2005,2005,Unprovoked,USA,Florida,Fort Lauderdale,Spearfishing,M,,Hand bitten,N,,J. Herrera
2005.02.04,04-Feb-2005,2005,Unprovoked,BRAZIL,Bahia,Ilhéus,Surfing,M,12,Right thigh & ankle injured,N,,"Orlando Sentinel, 2/5/2005, p.A6"
2005.01.20,20-Jan-2005,2005,Unprovoked,CUBA,Santiago de Cuba Province,Uvero,Swimming,M,19,Left foot severed,N,,Cuba News
2005.01.19,19-Jan-2005,2005,Provoked,AUSTRALIA,Victoria,Port Phillip Bay,Spearfishing,M,,No injury. Towed by speared shark PROVOKED INCIDENT,N,,Herald Sun News
2005.01.14,14-Jan-2005,2005,Provoked,AUSTRALIA,Victoria,Blairgowrie,Attempting to drive shark away from sailing regatta,,,"No injury to occupants, one of the boat's flotation tanks holed PROVOKED INCIDENT",N,afternoon,Herald Sun News
2005.01.08,08-Jan-2005,2005,Boating,NEW ZEALAND,North Island,Taupiri Bay,Fishing from a kayak,M,39,"No injury, kayak bumped repeatedly",N,morning,"R. Collier & R.D. Weeks, GSAF                "
2004.12.26,26-Dec-2004,2004,Invalid,SRI LANKA,Eastern Province,Pasikudha,"Swept out to sea by the tsunami, she clung  to a log for 24 hours",F,11,No injury,,,"R.D. Weeks, GSAF"
2004.12.16,16-Dec-2004,2004,Unprovoked,AUSTRALIA,South Australia,"West Beach, Adelaide",Scurfing (surfboard being  towed behind a boat),M,18,FATAL,Y,afternoon,"P. Kemp & T. Peake, GSAF"
2004.12.11,11-Dec-2004,2004,Unprovoked,AUSTRALIA,Queensland,Opal Reef,Spearfishing,M,38,"FATAL, leg bitten",Y,morning,"Weekend Australian, 2/17/2005, et al."
2004.11.27,27-Nov-2004,2004,Unprovoked,SOUTH AFRICA,Eastern Cape Province,"Nahoon, East London",Surfing,M,20,3 lacerations on foot,N,afternoon,J. Eager
2004.11.26,26-Nov-2004,2004,Unprovoked,SOUTH AFRICA,Eastern Cape Province,Gonubie,Playing,M,16,Lacerations on lower leg & foot,N,,J. Eager
2004.11.15,15-Nov-2004,2004,Unprovoked,SOUTH AFRICA,Western Cape Province,"Fish Hoek, False Bay",Swimming,F,77,FATAL,Y,morning,"J.P. Botha, GSAF"
2004.11.11.b,11-Nov-2004,2004,Unprovoked,USA,California,"Bunkers, Humboldt Bay, Eureka, Humboldt County",Surfing,M,38,"Lacerations to hand, knee & thigh ",N,morning,"R. Collier, GSAF                "
2004.11.11.a,11-Nov-2004,2004,Unprovoked,VANUATU,Malampa Province,Malakula (Malakula Island),Snorkeling,M,30,Thigh bitten,N,morning,"R. Harris, M.D., T. Peake, GSAF"
2004.11.00,Nov-2004,2004,Unprovoked,NEW CALEDONIA,North Province,Koumac,Diving,,,Forearm bitten,N,,"Les Nouvelles Caledoniennes, 11/19/2004"
2004.10.31,31-Oct-2004,2004,Unprovoked,CUBA,Camaguey Province,Santa Lucia,Diving,M,40,Left forearm bitten,N,afternoon,"E. Ritter, GSAF"
2004.10.30.a,30-Oct-2004,2004,Unprovoked,SOUTH AFRICA,Western Cape Province,Gansbaai,Chumming for white sharks,M,52,Right ankle & foot lacerated,N,morning,"J.P. Botha, GSAF"
2004.10.21,21-Oct-2004,2004,Unprovoked,AUSTRALIA,New South Wales,Stockton Beach,Surfing,M,59,Right foot lacerated,N,afternoon,"The Border Mail, 10/23/2004"
2004.10.10,10-Oct-2004,2004,Unprovoked,USA,California,"Limantour Beach, Point Reyes National Seashore",Surfing,M,,Lower leg bitten,N,morning,"R. Collier, GSAF"
2004.10.09.b,09-Oct-2004,2004,Unprovoked,USA,Hawaii,Moloka'i,Spearfishing,M,34,Left shoulder bitten,N,morning,"The Maui News, 10/10/2004 "
2004.10.09.a,09-Oct-2004,2004,Unprovoked,SOUTH AFRICA,Eastern Cape Province,Jeffreys Bay,Surfing,M,34,Puncture wounds on right foot,N,morning,"Sunday Argus, 10/10/2004; W. Steenkamp, Cape Times 10/9/2004"
2004.10.06,06-Oct-2004,2004,Unprovoked,REUNION,Conservatória District,"P' tit Paris, Saint-Pierre",Body boarding,M,15,"Leg severely bitten, surgically amputated",N,afternoon,Federation Francaise de Surf
