Case Number,Date,Year,Type,Country,Area,Location,Activity,Sex,Age,Injury,Fatal,Time,Investigator or Source
1955.09.23.a,23-Sep-1955,1955,Sea Disaster,NORTH PACIFIC OCEAN,1000 miles west of Hawaii,Between Wake & Johnston Islands,"""Flying Tiger"" transport plane went down with 5 men onboard",M,,Bitten several times before being rescued after 43 hours in the sea by the freighter Stell Advocate,N,,"Letter from Captain R. G. Rehrer in letter to G.A. Llano in Sharks and Survival, pp.381-382; V.M. Coppleson (1962), p.257"
1955.09.20,20-Sep-1955,1955,Unprovoked,USA,Hawaii,East Moloka'i,Hunting turtle,M,,Arm bitten,N,morning,"J. Borg, p.73; L. Taylor (1993), pp.100-101;  Note:  Date listed as Mar-1956 by V.M. Coppleson (1958), p.260 and 1956 by A. Resciniti, p.53"
1955.09.04,04-Sep-1955,1955,Unprovoked,USA,California,"Venice Beach, Los Angeles County",Swimming near breakwater,M,16,Dorsum of right foot lacerated,N,,"R. Collier, p.14-15; L.A. Times, 9/5/1955; V.M. Coppleson (1958), p.254; D. Miller & R. Collier;"
1955.08.30.b,30-Aug-1955,1955,Unprovoked,JAPAN,Izo Islands,"Mikura-jima Island, 150 miles south of Tokyo",Fishing,M,,FATAL,Y,,"K. Nakaya, L.A. Times, 8/31/1955; V.M. Coppleson (1962), p.247"
1955.08.30.a,30-Aug-1955,1955,Provoked,USA,California,"Zuma Beach, Santa Monica, Los Angeles County",Surfing,M,25,"Surfer grabbed shark, which turned & bit him and 2 lifeguards PROVOKED INCIDENT",N,,"SAF Case #244; D. Miller & R. Collier, V.M. Coppleson (1958), p.255"
1955.08.26,26-Aug-1955,1955,Unprovoked,CROATIA, Primorje-Gorski Kotar County,Opatija,Swimming,F,32,FATAL,Y,,R. Rocconi
1955.08.08,08-Aug-1955,1955,Unprovoked,AMERICAN SAMOA,Tutuila Island,Pago Pago Bay,Swimming,M,28,"FATAL, abdomen bitten  ",Y,,M. Hosina
1955.08.04.R,Reported 04-Aug-1955,1955,Provoked,USA,South Carolina,Windy Hill Beach,Fishing,M,,Finger bitten by hooked shark PROVOKED INCIDENT,N,,"Kingsport Times, 8/4/1955"
1955.08.00.c,Aug-1955,1955,Unprovoked,NORTH ATLANTIC OCEAN ,Open sea,,Treading water,M,15,No injury,N,,"H.D.Baldridge (1994), SAF Case #1489"
1955.08.00.a,Aug-1955,1955,Boating,AUSTRALIA,South Australia,Port Augusta,Fishing,,,Whelan's head was injured when he fell to the deck as shark rammed boat,N,,"V.M. Coppleson (1958), pp.184-185"
1955.07.25,25-Jul-1955,1955,Unprovoked,JAPAN,Okayama Prefecture,Usimado-no-Seto,,M,22,FATAL,Y,morning,M. Hosina
1955.07.23,23-Jun-1955,1955,Unprovoked,USA,Rhode Island,Occupasstuxet  (Patuxent) Cove,Wading,M,13,Bites on legs & thighs,N,,"The Lowell Sun, 7/24/1955"
1955.07.15,15-Jul-1955,1955,Unprovoked,MONTENEGRO,Adriatic Sea,Budva,Swimming,M,,FATAL,Y,,"R. Rocconi;               A. De Maddalena; Radovanovic (1965), Soldo & Jardas (2000)"
1955.07.07,07-Jul-1955,1955,Unprovoked,YEMEN,Aden,Telegraph Bay,Swimming,F,,"FATAL, back lacerated, arm & leg severed  ",Y,,"Evening Sun (Baltimore), 9/27/1955; V.M. Coppleson (1958), p.265; H.D. Baldridge, p.125; M. McDiarmid, p.65 "
1955.05.08,08-May-1955,1955,Provoked,USA,California,"Malibu, Los Angeles County",Spearfishing,M,28,Diver hit shark & right forearm slightly injured PROVOKED INCIDENT,N,,"D. Miller & R. Collier, V.M. Coppleson (1958), p.254; "
1955.05.00,May 1955,1955,Unprovoked,PAPUA NEW GUINEA,"Admiralty Islands, Manus Province","Lou Island, south of Manus Island",Spearfishing,M,,"Right forearm severely lacerated, left arm & hand lacerated",N,,"V.M. Coppleson (1958), pp.144-146 "
1955.04.13.R,Reported 13-Apr-1955,1955,Unprovoked,PAPUA NEW GUINEA,Central Province,"Hadrians (Haidana?) Island, near Port Moresby",Spearfishing or fishing,M,,Left shoulder bitten,N,,"South Pacific Post, 4/13/1955; V.M. Coppleson (1962), p.254"
1955.04.12,12-Apr-1955,1955,Unprovoked,PAPUA NEW GUINEA,,Abau,Spearfishing,M,,No injury. Shark took string of fish then struck canoe,N,,"South Pacific Post, 4/20/1955"
1955.04.00,Apr-1955,1955,Unprovoked,USA,Hawaii,"Hilo, Hawai'i","Fishing from boat, Kaimamla",M,,Hand bitten,N,,"Tribune-Herald (Hilo, Hawaii), 4/14/1963; J. Borg, p.73; L. Taylor, p.100-101 ; NOTE: Oshiro later sued owner of the boat for $15,000 in damages"
1955.03.09,09-Mar-1955,1955,Unprovoked,AUSTRALIA,New South Wales,Wamberal,Body surfing,M,22,FATAL,Y,afternoon,"V.M. Coppleson (1958), pp.84-85 & 236; A. Sharpe, pp.82-83"
1955.03.00.b,Mar-1955,1955,Unprovoked,PAPUA NEW GUINEA,"New Ireland, Bismarck Archipelago","Kabiman, West coast",Swimming with speared fish,M,,Left leg bitten,N,,"Namatanai Dept. of Public Health;  A. M. Rapson, p.148"
1955.03.00.a,Mar-1955,1955,Provoked,AUSTRALIA,Western Australia,Woodmans Point,"Competing in U/W endurance record, standing beside drum in 10' of water",M,25,Leg of wetsuit torn after spear fired at shark  PROVOKED INCIDENT,N,morning,"H.D. Baldridge, p.104"
1955.02.10,10-Feb-1955,1955,Unprovoked,USA,California,"Trinidad Bay, Humboldt County",Scuba diving,M,,"No injury, shark bumped diver's face",N,,"J. DeWitt (1955); V.M. Coppleson (1962), p.255; D. Miller & R. Collier"
1955.02.06,06-Feb-1955,1955,Unprovoked,USA,California,"Pacific Grove, Monterey County",Spearfishing,M,19,"Swimfin & 2 wool socks removed by shark, suit torn",N,morning,"R. Collier, pp. 13-14; D. Miller & R. Collier; California Fish & Game; V.M. Coppleson (1958), pp. 156 & 254; H.D. Baldridge, p.68"
1955.02.05,05-Feb-1955,1955,Unprovoked,AUSTRALIA,New South Wales,"Sugarloaf Bay, Middle Harbor, Sydney",Swimming,M,25,"FATAL, legs bitten ",Y,afternoon,"V.M. Coppleson (1958), pp.71, 175 & 236; A. Sharpe, pp.74-75"
1955.02.04,04-Feb-1955,1955,Unprovoked,INDIA,Tamil Nadu,"Vanagiri, Madras (Chennai), Bay of Bengal",Fishing,M,25,Leg bitten,N,,"V.M. Coppleson (1958), p.261"
1955.02.00,Feb-1955,1955,Boating,AUSTRALIA,New South Wales,Coffs Harbor,Rowing toward snapper grounds,,,"No injury to occupants, 6 sharks charged boat",N,,"V.M. Coppleson (1958), p.186"
1955.01.17,17-Jan-1955,1955,Unprovoked,AUSTRALIA,New South Wales,"Wyargine Point, Edwards Beach, Balmoral Beach, Sydney",Hunting lobsters in 2.4 m of water,M,13,"FATAL, anterior left leg & right calf bitten, no tissue lost  ",Y,afternoon,"V.M. Coppleson (1958), pp.71, 174-175 & 236; A. Sharpe, p.74"
1955.01.15,15-Jan-1955,1955,Unprovoked,SOUTH AFRICA,KwaZulu-Natal,A ford known as Brodies Coffin in St. Lucia Bay,Crossing the bay at the ford,M,,"FATAL, leg bitten ",Y,afternoon,"Natal Daily News, 1/17/1955; M. Levine, GSAF"
1955.00.00.d,1955,1955,Provoked,CUBA,Havana Province,Cojimar,Fishing,M,,Forearm slashed wrist to elbow by hooked shark he was trying to club to death  PROVOKED INCIDENT,N,,"F. Poli, p.13"
1955.00.00.e,1955,1955,Unprovoked,MADAGASCAR,18S / 50E,,Standing in knee-deep water,M,16,FATAL,Y,afternoon,Mrs. Lyse Mooney
1955.00.00.c,1955,1955,Invalid,USA,Illinois,Chicago (Lake Michigan),Swimming,M,,Right leg allegedly bitten by a bull shark,,,"F. Dennis, p.52"
1955.00.00.b,Ca. 1955 ,1955,Unprovoked,COLUMBIA,Isles del Rosario,Southwest of Cartegena,Spearfishing,M,12,Swim fin & foot bitten,N,,"H. Echavarria; H.D. Baldridge, p.135; M. McDiarmid, p.64"
1954.12.29,29-Dec-1954,1954,Unprovoked,AMERICAN SAMOA,Tutuila Island,Near tuna cannery in Pago Pago Harbor,Dived overboard & was swimming near stern of trawler,M,27,FATAL,Y,,"Townsville Daily Bulletin, 1/6/1955"
1954.12.11,11-Dec-1954,1954,Unprovoked,AUSTRALIA,Victoria,Point Lonsdale,Swimming,M,23,FATAL,Y,morning,"Sydney Morning Herald, 12/13/1954"
1954.12.09,09-Dec-1954,1954,Unprovoked,PAPUA NEW GUINEA,Central Province,"Kila Beach, Port Moresby",Swimming near canoe,M,,"FATAL, abdomen & thigh bitten",Y,morning,"C.H. Hodgson;  A. M. Rapson, p.148"
1954.12.04,04-Dec-1954,1954,Unprovoked,SOUTH AFRICA,KwaZulu-Natal,"Rocket Hut Beach, Durban",Swimming,M,16,Shallow lacerations on torso,N,morning,"D. Gibb, M. Levine, GSAF  "
1954.11.20,20-Nov-1954,1954,Unprovoked,USA,Wake Island,Wilkes Islet Lagoon (Pacific Ocean north of the Marshall Islands),Spearfishing,M,,Shoulder bitten,N,afternoon,"J. L. Oetzel, NOTE: H.D. Baldridge, p.143 lists date as March 20, 1954 "
1954.10.07,07-Oct-1954,1954,Sea Disaster,USA,Virginia,150 miles off Cape Henry,"American freighter Mormackite, bound from Buenos Aires for Baltimore, capsized & sank in heavy seas",M,,Rescue aircraft saw bodies in the water being bitten by sharks. One survivor saw a shark take off a mans leg & another reported that the second cook was killed by a shark,Y,,"Long Beach Independent, 10/11/1954, p.9; V.M. Coppleson (1958), p.197; V.M. Coppleson (1962), pp. 213 & .259"
1954.10.06,06-Oct-1954,1954,Provoked,UNITED KINGDOM,Isle of Man,Off Fleetwood,Fishing  (trawling),M,62,Arm broken by tail of netted shark PROVOKED INCIDENT,N,,"C.Moore, GDSF; Times of London, 10/7/1954"
1954.10.02.a,02-Oct-1954,1954,Invalid,JAPAN,Nagasaki Prefecture,Oomura Bay,,M,13,Body found in gut of 2000-lb white shark,,,"K. Nakaya; San Diego Union, 105/1954 "
1954.09.21,21-Sep-1954,1954,Unprovoked,USA,California,"La Jolla, San Diego County",Swimming,M,35,Minor bruises & abrasions on leg,N,,"D. Miller & R. Collier, V.M. Coppleson (1958), p.254; T. Helm, p.232"
1954.09.15,15-Sep-1954,1954,Unprovoked,HONG KONG,,Junk Bay,Swimming,M,20,"FATAL, leg severely bitten",Y,,"V.M. Coppleson (1958), p.260; A. MacCormick, p.121 citing Times of London 9/17/1954; [SAF Cases #299 & #298"
1954.09.04,04-Sep-1954,1954,Unprovoked,AUSTRALIA,Torres Strait,"Darnley Island, Torres Strait","Spearfishing, hunting crayfish",M,35,"FATAL, after being bitten by shark, he was picked up by 85' trochus vessel Toorah that wrecked. His wounds reopened & he died ",Y,,"The Mercury, 9/14/1954"
1954.08.19,19955,1954,Unprovoked,ITALY,Liguaria,Finale Ligure,Spearfishing,M,27,Abdomen injured,N,,"C. Moore, GSAF"
1954.08.12.b,12-Aug-1954,1954,Provoked,CUBA,Guantanamo Province,Boqueron,Spearfishing,M,,Knee bitten by shark that his dive buddy had shot  PROVOKED INCIDENT,N,,"H.D. Baldridge, p.166"
1954.08.12.a,12-Aug-1954,1954,Provoked,CUBA,Guantanamo Province,Boqueron,Spearfishing,M,,Right thigh & left calf injured by speared shark  PROVOKED INCIDENT,N,,"H.D. Baldridge, p.166"
1954.07.30,30-Jul-1954,1954,Unprovoked,ECUADOR,Galapagos Islands,,"Tuna fishing, standing on stern platform that was submerged by waves",M,34,4 lacerations on dorsum of right foot ,N,,"F. X. Schloeder, M.D.; V.M. Coppleson (1962), p.246"
1954.07.28,28-Jul-1954,1954,Unprovoked,SINGAPORE,,Singapore Harbor,Closed circuit diving (submerged). Diving to recover jettisoned packets of opium for police,M,28,"FATAL, abdomen, buttock, right thigh & hands bitten ",Y,,"New York Times, 7/29/1954; V.M. Coppleson (1958), p.266; H.D. Baldridge, p.183; "
1954.07.27,27-Jul-1954,1954,Boating,ITALY,Venice Province,Off Chioggia,Fishing trawler Flavio Gioia ,M,,No injury to occupants. Shark tore nets & trawl and struck boat repeatedly,,night,"C. Moore, GSAF"
1954.07.15,15-Jul-1954,1954,Unprovoked,THE BALKANS,Slovenia,Between Punta Grossa & Koper,Swimming,M,,FATAL,Y,,"R. Rocconi & C. Moore, GSAF            V.M. Coppleson, p.261; H. D. Baldridge, p.15"
1954.07.03,03-Jul-1954,1954,Unprovoked,BERMUDA,South shore ,Elbow Beach,Swimming,M,22,"Left thigh bitten, chest lacerated  & defense wounds on foot, fingers and hands",N,,"E.M. Marks; V.M. Coppleson (1958), pp.155 & 257; Randall, p.353 in Sharks & Survival"
1954.06.29,29-Jun-1954,1954,Provoked,USA,California,"Santa Monica, Los Angeles County",Grabbed shark & threw it on deck,M,35,Right elbow & forearm lacerated  PROVOKED INCIDENT,N,,"L.A. Times, 6/30/1954; H.D. Baldridge, p.257"
1954.06.27,27-Jun-1954,1954,Unprovoked,AUSTRALIA,Queensland,Fitzroy Island,Pearl diving from lugger Whyalla,M,30,"Shark bit right arm & shoulder, then Aken says, he ""knocked out"" the shark",N,afternoon,"Morning Bulletin (Rockhampton), 6/30/1954 "
1954.05.26.R,Reported 26-May-1954,1954,Unprovoked,PAPUA NEW GUINEA,East Sepik,Wewak,"Fishing / cleaning fish, dived into water to retrieve a lost fish",M,,"FATAL, decapitated ",Y,,"South Pacific Post, 5/26/1954"
1954.04.08,08-Apr-1954,1954,Invalid,USA,Hawaii,"Wailupe, O'ahu",Fishing from shore,M,,"Body recovered, mutilated by shark/s",,,"The Honolulu Advertiser, 4/8/1954; Honoulu Star Bulletin 4/8/1954; J. Borg, p.73; L. Taylor (1993), pp.100-101"
1954.04.00,Apr-1954,1954,Provoked,SUDAN?,Red Sea,Southern part ,Spearfishing,M,,"Speared small shark, shark bit his thigh and/or buttock PROVOKED INCIDENT",N,,"V.M. Coppleson (1962), p.254; H.D. Baldridge, p.165"
1954.02.27,27-Feb-1954,1954,Unprovoked,AUSTRALIA,New South Wales,"The Entrance, near Gosford",Swimming,M,23,"FATAL, right thigh bitten ",Y,afternoon,"V.M. Coppleson (1958), pp.84 & 236"
1954.01.30,30-Jan-1954,1954,Unprovoked,AUSTRALIA,New South Wales,Avoca Beach,Swimming,M,,Abrasions to arm,N,,"Sun-Herald, 1/31/1954"
1954.01.22.b,22-Jan-1954,1954,Unprovoked,AUSTRALIA,Torres Strait,Naghir Island,Spearfishing,M,30,Severe laceration to arm,N,,"Cairns Post, 1/25/1954"
1954.01.22.a,22-Jan-1954,1954,Unprovoked,ARGENTINA,Buenos Aires Province,"Miramar Beach, 46 km south of Mar de Plata, Buenos Aires ",Floating,M,18,"Arm & left calf bitten, right leg lacerated",N,morning,"V.M. Coppleson (1958), p.257; Garrick & L. Schultz in Sharks & Survival, p.13; M. McDiarmid, p.64"
1954.01.15,15-Jan-1954,1954,Unprovoked,PAPUA NEW GUINEA,Madang Province,"Singour, 60 miles south of Madang",Crouching in the water,M,26,Back & thighs lacerated,N,,"Cairns Post, 1/21/1954"
1954.00.00.e,1954,1954,Unprovoked,IRAN,Karun River,"Hesamabad area of Shushtar, 420 km from the sea",,M,,FATAL,Y,,B. Coad
1954.00.00.b,1954,1954,Unprovoked,USA,Hawaii,Moloka'i,Fishing,M,,Bitten on foot,N,,"J. Borg, p.73; L. Taylor (1993), pp.100-101"
1954.00.00.a,1954,1954,Unprovoked,PAPUA NEW GUINEA,West New Britain Province,"Volupai, Talasea",Swimming,M,12,Leg & abdomen lacerated,N,," A. M. Rapson, p.148"
1954.00.00 g,1954 (same day as  1954.00.00.f),1954,Unprovoked,IRAN,Karun River,A village a short distance from Hesamabad,,F,,FATAL,Y,,B. Coad
1954.00.00 f,1954 (same day as  1954.00.00.f),1954,Unprovoked,IRAN,Karun River,"Hesamabad area of Shushtar, 420 km from the sea",,M,,Survived,N,,B. Coad
1953.12.30,30-Dec-1953,1953,Unprovoked,SOUTH AFRICA,Eastern Cape Province,"Second Beach, Port St. Johns",Swimming,F,,Left calf lacerated,N,morning,"Natal Mercury, 12/31/1953"
1953.12.22,22-Dec-1953,1953,Unprovoked,SOUTH AFRICA,Eastern Cape Province,Port Elizabeth,Swimming,M,23,Lacerations to arm,N,,H. Monson
1953.12.13,13-Dec-1953,1953,Unprovoked,AUSTRALIA,Queensland,Palm Beach,Swimming or wading out  to warn bathers that a shark had been seen,M,16,Bruised shoulder chest & foot,N,morning,"V.M. Coppleson (1958), pp.95 & 240"
1953.12.00,Dec-1953,1953,Unprovoked,AUSTRALIA,New South Wales,Maroubra Beach,Surf skiing,M,,"No Injury, shark charged surfski",N,," V.M. Coppleson (1958), p.42"
1953.09.27,27-Sep-1953,1953,Unprovoked,PHILIPPINES,Luzon Island,Bohol,,M,23,FATAL,Y,,"Palm Beach Post, 9/28/1953"
1953.09.20.R,Reported 20-Sep-1953,1953,Unprovoked,USA,California,"Santa Catalina Island, Los Angeles County",Scuba diving,M,,No injury,N,,"Oakland Tribune, 9/20/1953"
1953.09.18,18-Sep-1953,1953,Sea Disaster,USA,Georgia,200 miles east of Savannah,Aircaft exploded,M,,Hand bitten,N,,New York Times 
1953.09.03.R,Reported 03-Sep-1953,1953,Unprovoked,USA,New York,Rockaway Beach,Surf fishing,M,15,Laceration to right lower leg,N,,"The Dispatch, 9/3/1953"
1953.09.02,02-Sep-1953,1953,Unprovoked,USA,Hawaii,"Waiau, Pearl Harbor, O'ahu",Crabbing,M,,Leg & foot bitten,N,,"Honolulu Star Bulletin, 9/2/1953; G.H. Balazs; J. Borg, p.73; L. Taylor (1993), pp.100-101"
1953.08.00,Aug-1953,1953,Invalid,MEXICO,Guerrero,Acapulco,Free diving,M,19,No injury,,afternoon,H.D. Baldridge (1994) SAF Case #679
1953.07.31,31-Jul-1953,1953,Unprovoked,MEXICO,Colima,Manzanillo,Wading,F,18,FATAL,Y,,"V.M. Coppleson (1958), p.262; J.M. Alatorre"
1953.07.26,26-Jul-1953,1953,Unprovoked,USA,Hawaii,"Maile Beach, O'ahu",Spearfishing,M,15,"FATAL, thigh bitten",Y,morning,"V.M. Coppleson (1958), p.260; L. Taylor (1993), pp.100-101"
1953.07.16,16-Jul-1953,1953,Provoked,USA,California,"Santa Catalina Island, Los Angeles County",Fishing from market fishboat Sea Spray,M,,Arm bitten by hooked shark PROVOKED INCIDENT,N,,"L.A. Times, 7/17/1953 "
1953.07.15,15-Jul-1953,1953,Unprovoked,USA,Florida,"Juno Beach, Palm Beach County",Standing,F,26,Lower left leg severely bitten,N,,"R.F. Hutton; T. Helm, p. 231 "
1953.07.09,09-Jul-1953,1953,Boating,CANADA,Nova Scotia,"Fourchu, Cape Breton Island",Fishing for lobsters,M,,Burns drowned as result of attack on boat,N,,"R. Collier, pp.169-170;Bigelow & Schroeder;  Day & Fisher, pp. 295-296"
1953.07.04,04-Jul-1953,1953,Unprovoked,USA,Hawaii,Kaula Rock near Niihau ,Accidentally dragged overboard from the sampan Holokahana into school of yellowfin tuna,M,,"Shark made 3 passes at him, lacerating his calf, shin and ankle ",N,morning,"Honolulu Advertiser, July 5, 1953 edtion; V.M. Coppleson (1958), p.260; J. Borg, p. 2;  L. Taylor (1993), pp.100-101"
1953.07.00,01-Jul-1953,1953,Unprovoked,PANAMA,Gulf of Panama,60 miles offshore ,Retrieving bait box that had fallen overboard,M,19,Hand severely bitten,N,,"V.M. Coppleson (1958), p.263;  LA. Times, 6/9/1954;  Gorgas Hospital Record #667474"
1953.06.00,Jun-1953,1953,Provoked,AUSTRALIA,Queensland,,Landing hooked shark in boat,M,,Right forearm & hand bitten PROVOKED INCIDENT,N,,"V.M. Coppleson (1958), p.179"
1953.04.04,04-Apr-1953,1953,Unprovoked,USA,Texas,South Padre Island,Swimming,F,19,Lacerations to right foot,N,afternoon,"Valley Morning Star, 4/5/1953"
1953.04.00.b,Apr-1953,1953,Unprovoked,IRAN,Karun River,"near Ahvaz, 275 km from the sea",,M,,Arm severed,N,,B. Coad
1953.04.00.a,Apr-1953,1953,Unprovoked,IRAN,Karun River,"near Ahvaz, 275 km from the sea",Swimming in midriver near sewage outlet & 400 m from a slaughterhouse,M,,Right forearm severed at the elbow,N,,B. Coad
1953.03.22,Mar-1953,1953,Unprovoked,AUSTRALIA,New South Wales,"Long Reef, Collaroy",Spearfishing,M,23,Arm lacerated,N,,"V.M. Coppleson (1958), pp.166-167"
1953.03.19.R,Reported 19-Mar-1953,1953,Unprovoked,AUSTRALIA,South Australia,"Schnapper Rock, Kirton Point",Spearfishing,M,,Abrasion,N,,"The Advertiser, 3/19/1953"
1953.03.00.a,Mar-1953,1953,Unprovoked,PAPUA NEW GUINEA,Milne Bay Province,"Off Rossel Island, Louisiade Archipelago",Went over side of boat at trochus ground,M,,"FATAL, arm & leg severed & shark smashed at his body with its tail  ",Y,,"A.M. Rapson, p.148; V.M. Coppleson (1962), p.254"
1953.02.18,18-Feb-1953,1953,Provoked,USA,Hawaii,"Barbers Point, O'ahu",Bitten while cutting shark from net,M,,Hand bitten  PROVOKED INCIDENT  ,N,,"V.M. Coppleson (1958), p.260; G.H. Balazs; J. Borg, p.72; L. Taylor (1993), pp.100-101"
1953.02.15,15-Feb-1953,1953,Unprovoked,AUSTRALIA,New South Wales,Cave at Shell Harbour,Spearfishing,M,25,"Shark tore off face mask, divers face, nose & chin lacerated",N,afternoon,"Spearfishing News, April 1953, p.5; J. Oetzel in Skin Diver Magazine, March 1965, p.17; V.M. Coppleson (1958), p.33"
1953.01.20,20-Jan-1953,1953,Provoked,AUSTRALIA,South Australia,Largs Bay,Fishing,M,61,Finger bitten by hooked shark PROVOKED INCIDENT,N,,"The Advertiser, 1/23/1953"
1953.01.08,08-Jan-1953,1953,Boating,AUSTRALIA,Tasmania,Wynyard,Fishing,,,"No injury to occupant, shark charged boat",N,afternoon,"C. Black, GSAF"
1953.00.00.b,1953,1953,Unprovoked,PAPUA NEW GUINEA,Bougainville (North Solomons),"Kahuli, Buka Island",Washing,M,,"FATAL, torso bitten",Y,,"A. Bleakley;  A. M. Rapson, p.148"
1953.00.00.a,1953,1953,Unprovoked,USA,Florida,"Juno Beach, Palm Beach County",Standing,F,,Leg lacerated thigh to ankle,N,," V.M. Coppleson (1958), p.254; R. F. Hutton"
1952.12.24,24-Dec-1952,1952,Unprovoked,AUSTRALIA,Victoria,"Portsea Beach, near Melbourne",Lying prone on surfboard,M,,"No injury, board bumped by shark",N,,"V.M. Coppleson (1962), frontspiece"
1952.12.21,21-Dec-1952,1952,Unprovoked,AUSTRALIA,South Australia,Cape Douglas,"Fishing, setting nets",M,25,Bitten on thigh and buttocks,N,,"V.M. Coppleson (1958), p.178; V.M. Coppleson (1962), p.245"
1952.08.04,04-Aug-1952,1952,Provoked,ITALY,Genoa  Province,Riva Trigoso,Fishing,M,17,Bitten by hooked shark                      PROVOKED INCIDENT,N,," C. Moore, GSAF"
1952.08.03,03-Aug-1952,1952,Unprovoked,USA,Hawaii,"Between Ala Moana Channel & Kewalo Basin, O'ahu",Swimming,M,,"FATAL, disappeared while swimming, shark bite found on right side of body",Y,,"Honolulu Advertiser, 12/4/1952; G.H. Balazs & A.K.H. Kam; J. Borg, p.72; L. Taylor (1993), pp.100-101;"
1952.12.07,7-Dec-1952,1952,Unprovoked,USA,California,"Pacific Grove, Monterey Bay, Monterey County",Body surfing & treading water,M,17,"FATAL, leg lacerated  ",Y,afternoon,"R. L. Bolin, D. Miller & R. Collier, R. Skocik, p.174;V.M. Coppleson (1958), pp.156 & 254; R. Collier, pp.10-13"
1952.12.03,03-Dec-1952,1952,Unprovoked,USA,Hawaii,"Maile Beach, O'ahu",Swimming from fishing boat setting nets,M,40,"FATAL, left arm severed below the elbow ",Y,," Honolulu Advertiser, 12/4/1952; V.M. Coppleson (1958), p.260; J. Borg, p.74; Webster, p.31;  L. Taylor (1993), pp.100-101"
1952.10.12,12-Oct-1952,1952,Unprovoked,PAPUA NEW GUINEA,"Abau Sub District, Central Province",Lalaura Village,Fishing,M,,Right thigh bitten ,N,,"A. Bleakley; A.M. Rapson, p.148"
1952.08.06,06-Aug-1952,1952,Invalid,SOUTH AFRICA,Eastern Cape Province,Nelsons Rock,,M,18,"Possibly drowned, remains recovered days later in gut of  113-kg [249-lb]  female Zambesi shark ",,,"Daily Dispatch; M. Levine, GSAF"
1952.08.05,05-Aug-1952,1952,Provoked,ITALY,Teramo,Giulianova,Fishing,,19,Multiple injuries PROVOKED INCIDENT,Y,,"C. Moore, GSAF"
1952.07.27.d,27-Jul-1952,1952,Boating,USA,Florida,"Panacea, Wakulla County",Fishing for trout ,,,No injury to occupants. Shark chasing fish leapt into skiff & flopped out,N,,"Evening Sun (Baltimore), 7/28/1952"
1952.07.27.c,27-Jul-1952,1952,Provoked,USA,South Carolina,Seabrook Beach,Fishing,M,43,Finger bitten by hooked shark PROVOKED INCIDENT,N,,"News and Courier, 7/28/1952"
1952.07.27.b,27-Jul-1952,1952,Provoked,USA,South Carolina,Seabrook Beach,Fishing,M,34,Thumb bitten by hooked shark PROVOKED INCIDENT,N,,"News and Courier, 7/28/1952"
1952.07.27.a,27-Jul-1952,1952,Sea Disaster,USA,California,"Off Santa Monica, Los Angeles County",Boat exploded,M,,FATAL & some of the survivors were bitten by sharks  ,Y,,R. Collier
1952.07.13,13-Jul-1952,1952,Provoked,USA,California,"San Diego, San Diego County",Fishing,M,34,Part of hand removed by shark he had caught PROVOKED INCIDENT,N,,"L.A. Times, 7/14/1952 "
1952.07.05,05-Jul-1952,1952,Unprovoked,USA,Puerto Rico,"Mona Island, 40 miles west of the mainland ","Spearfishing, carrying fish on spear",M,,Leg lacerated & bone fractured ,N,morning,"V.M. Coppleson (1958), p.265; J. Randall in Sharks and Survival, p.346"
1952.05.27,27-May-1952,1952,Unprovoked,USA,California,"Imperial Beach, San Diego County",Swimming on surface,M,,Foot & swimfin bitten,N,morning,"R. Collier, pp.8-9"
1952.05.07.R,Reported 07-May-1952,1952,Unprovoked,AUSTRALIA,Western Australia,Boyup Brook,"Fishing, standing in water washing fish",M,,Lacerations to 2 fingers & knuckles abraded,N,,"T. Peake, GSAF; West Australian, 5/7/1952"
1952.05.00,May-1952,1952,Unprovoked,INDIA,,Off Trivandrum (west coast),"Fishing, standing in water next to purse net",M,,Lower leg lacerated,N,,"F. Dennis, p.10"
1952.04.06,06-Apr-1952,1952,Boating,AUSTRALIA,South Australia,Streaky Bay,Fishing for white sharks,,,No injury to fisherman Alf Dean & other occupants;,N,morning,"Recorder (Port Pirie), 4/7/1952"
1952.04.00,Apr-1952,1952,Provoked,SUDAN,Red Sea State,"Suakin Harbor, Suakin Island",Spearfishing,M,,Right forearm lacerated by speared shark PROVOKED INCIDENT,N,,"H. Hass in We Come From the Sea, pp.42-46"
1952.03.30,30-Mar-1952,1952,Unprovoked,NETHERLANDS ANTILLES,Curacao,,Went to aid of child being menaced by the shark,M,,"Buttock bitten, tissue removed",N,,"J. Randall, p.352 in Sharks & Survival; H.D. Baldridge, p.172"
1952.01.23,23-Jan-1952,1952,Provoked,MAURITIUS,Port Louis Province,Port Louis,"Spearfishing, speared a small shark",M,,Right foot lacerated by a larger shark. Lost several toes  PROVOKED INCIDENT,N,,"V.M. Coppleson (1958), p.262; V.M. Coppleson (1962), p.253"
1952.01.07,07-Jan-1952,1952,Unprovoked,AUSTRALIA,New South Wales,Evans Head,Surfing,M,,Bitten on left calf and ankle,N,,"Canberra Times, 1/8/1952"
1952.00.00.e,1952-1954,1952,Unprovoked,LIBERIA,Montserrado,"West Breakwater, Monrovia / Freeport","Diving, recovering fish killed by dynamite",M,,FATAL,Y,,G.C. Miller
1952.00.00.d,1952,1952,Unprovoked,PAPUA NEW GUINEA,"Admiralty Islands, Manus Province",Manus Island,Spearfishing,M,,"Arm bitten, surgically amputated",N,,"Cairns Post, 11/27/1952"
1952.00.00.c,1952,1952,Unprovoked,PAPUA NEW GUINEA,"Admiralty Islands, Manus Province","Momote, Manus Island",Spearfishing,M,,"FATAL,  ""No remains""",Y,,"A. Bleakley;  A. M. Rapson, p.148; H.D. Baldridge, p. 129"
1952.00.00.b,1952,1952,Unprovoked,PAPUA NEW GUINEA,New Ireland Province,"Samo Plantation, east coast ",Spearfishing,M,27,"FATAL, lower abdomen removed ",Y,,"A. Bleakley;  Namatanai Dept. of Public Health; A. M. Rapson, p.148"
1952.00.00.a,1952,1952,Unprovoked,USA,Florida,Near Key West,Swimming,M,,"FATAL, groin bitten ",Y,,"V.M. Coppleson (1958), p.254; R. F. Hutton; T. Helm, p.230;"
1951.12.21,21-Dec-1951,1951,Unprovoked,MOZAMBIQUE,Bay of Maputu,Catembe ,Swimming,M,15,"FATAL, right leg, thighs & hands bitten  ",Y,,GSAF
1951.12.16,16-Dec-1951,1951,Provoked,AUSTRALIA,New South Wales,North Bondi,Spearfishing,M,18,Speared shark lacerated left leg above ankle  PROVOKED INCIDENT,N,,"V.M. Coppleson (1958), pp. 171-172"
1851.12.15.R,"
1951.12.15.R",1951,Invalid,MOZAMBIQUE,Sofala Province,Beira,Swimming,M,,No injury,,,GSAF
1951.12.06,6-Dec-1951,1951,Unprovoked,AUSTRALIA,New South Wales,"Merewether Beach, Newcastle",Treading water,M,21,FATAL,Y,afternoon,"V.M. Coppleson (1958), pp.79; A. Sharpe, p.85"
1951.11.29,29-Nov-1951,1951,Unprovoked,SOUTH AFRICA,KwaZulu-Natal,"South Beach, Durban",Swimming,M,23,Thigh bruised & abraded,N,morning,"G. Plowman, M. Levine, GSAF "
